Title,Subtitle,Authors,ISBN,LCC,Publish Date,Description,Thumbnail,Small,Medium,Large,Preview
User Stories Applied,For Agile Software Development,Mike Cohn,9780321205681,QA76.76.D47 C643 2004,2004,"Agile requirements: discovering what your users really want. With this book, you will learn to: Flexible, quick and practical requirements that workSave time and develop better software that meets users' needsGathering user stories -- even when you can't talk to usersHow user stories work, and how they differ from use cases, scenarios, and traditional requirementsLeveraging user stories as part of planning, scheduling, estimating, and testingIdeal for Extreme Programming, Scrum, or any other agile methodology---------------------------------------------------------------------------------------------------------- Thoroughly reviewed and eagerly anticipated by the agile community, User Stories Applied offers a requirements process that saves time, eliminates rework, and leads directly to better software. The best way to build software that meets users' needs is to begin with user stories: simple, clear, brief descriptions of functionality that will be valuable to real users. In User Stories Applied, Mike Cohn provides you with a front-to-back blueprint for writing these user stories and weaving them into your development lifecycle. You'll learn what makes a great user story, and what makes a bad one. You'll discover practical ways to gather user stories, even when you can't speak with your users. Then, once you've compiled your user stories, Cohn shows how to organize them, prioritize them, and use them for planning, management, and testing. User role modeling: understanding what users have in common, and where they differ Gathering stories: user interviewing, questionnaires, observation, and workshopsWorking with managers, trainers, salespeople and other proxiesWriting user stories for acceptance testing Using stories to prioritize, set schedules, and estimate release costsIncludes end-of-chapter practice questions and exercises User Stories Applied will be invaluable to every software developer, tester, analyst, and manager working with any agile method: XP, Scrum... or even your own home-grown approach. ADDISON-WESLEY PROFESSIONAL Boston, MA 02116 www.awprofessional.com ISBN: 0-321-20568-5",http://bks7.books.google.com/books?id=SvIwuX4SVigC&printsec=frontcover&img=1&zoom=5&edge=none&source=gbs_api,http://bks7.books.google.com/books?id=SvIwuX4SVigC&printsec=frontcover&img=1&zoom=1&edge=none&source=gbs_api,http://bks7.books.google.com/books?id=SvIwuX4SVigC&printsec=frontcover&img=1&zoom=2&edge=none&source=gbs_api,http://bks7.books.google.com/books?id=SvIwuX4SVigC&printsec=frontcover&img=1&zoom=3&edge=none&source=gbs_api,http://books.google.com/books?id=SvIwuX4SVigC&printsec=frontcover&dq=isbn:9780321205681&hl=&cd=1&source=gbs_api
Agile Estimating and Planning,"",Mike Cohn,9780131479418,QA76.76.D47 C6427 2006,2005-11-01,"Agile Estimating and Planning is the definitive, practical guide to estimating and planning agile projects. In this book, Agile Alliance cofounder Mike Cohn discusses the philosophy of agile estimating and planning and shows you exactly how to get the job done, with real-world examples and case studies. Concepts are clearly illustrated and readers are guided, step by step, toward how to answer the following questions: What will we build? How big will it be? When must it be done? How much can I really complete by then? You will first learn what makes a good plan-and then what makes it agile. Using the techniques in Agile Estimating and Planning , you can stay agile from start to finish, saving time, conserving resources, and accomplishing more. Highlights include: Why conventional prescriptive planning fails and why agile planning works How to estimate feature size using story points and ideal days–and when to use each How and when to re-estimate How to prioritize features using both financial and nonfinancial approaches How to split large features into smaller, more manageable ones How to plan iterations and predict your team's initial rate of progress How to schedule projects that have unusually high uncertainty or schedule-related risk How to estimate projects that will be worked on by multiple teams Agile Estimating and Planning supports any agile, semiagile, or iterative process, including Scrum, XP, Feature-Driven Development, Crystal, Adaptive Software Development, DSDM, Unified Process, and many more. It will be an indispensable resource for every development manager, team leader, and team member.",http://bks3.books.google.com/books?id=BuFWHffRJssC&printsec=frontcover&img=1&zoom=5&edge=none&source=gbs_api,http://bks3.books.google.com/books?id=BuFWHffRJssC&printsec=frontcover&img=1&zoom=1&edge=none&source=gbs_api,http://bks3.books.google.com/books?id=BuFWHffRJssC&printsec=frontcover&img=1&zoom=2&edge=none&source=gbs_api,http://bks3.books.google.com/books?id=BuFWHffRJssC&printsec=frontcover&img=1&zoom=3&edge=none&source=gbs_api,http://books.google.com/books?id=BuFWHffRJssC&printsec=frontcover&dq=isbn:9780131479418&hl=&cd=1&source=gbs_api
Agile Software Development,"",Alistair Cockburn,9780201699692,QA76.76.D47 C634 2002,2002,Alastair Cockburn offers advice on bringing difficult software development projects to a successful conclusion with a minimum of stress. The volume is based on over 10 years of interviewing software project teams.,http://bks2.books.google.com/books?id=sK1QAAAAMAAJ&printsec=frontcover&img=1&zoom=5&source=gbs_api,http://bks2.books.google.com/books?id=sK1QAAAAMAAJ&printsec=frontcover&img=1&zoom=1&source=gbs_api,http://bks2.books.google.com/books?id=sK1QAAAAMAAJ&printsec=frontcover&img=1&zoom=2&source=gbs_api,http://bks2.books.google.com/books?id=sK1QAAAAMAAJ&printsec=frontcover&img=1&zoom=3&source=gbs_api,http://books.google.com/books?id=sK1QAAAAMAAJ&dq=isbn:9780201699692&hl=&cd=1&source=gbs_api
Clean Code,A Handbook of Agile Software Craftsmanship,Robert C. Martin,9780132350884,QA76.76.D47 C583.2009,2009,"Looks at the principles and clean code, includes case studies showcasing the practices of writing clean code, and contains a list of heuristics and smells accumulated from the process of writing clean code.",http://bks9.books.google.com/books?id=dwSfGQAACAAJ&printsec=frontcover&img=1&zoom=5&source=gbs_api,http://bks9.books.google.com/books?id=dwSfGQAACAAJ&printsec=frontcover&img=1&zoom=1&source=gbs_api,http://bks9.books.google.com/books?id=dwSfGQAACAAJ&printsec=frontcover&img=1&zoom=2&source=gbs_api,http://bks9.books.google.com/books?id=dwSfGQAACAAJ&printsec=frontcover&img=1&zoom=3&source=gbs_api,http://books.google.com/books?id=dwSfGQAACAAJ&dq=isbn:9780132350884&hl=&cd=1&source=gbs_api
The capability maturity model,guidelines for improving the software process,Mark C. Paulk,9780201546644,QA76.76.D47 C37 1995,1995,"Principal Contributors and Editors: Mark C. Paulk, Charles V. Weber, Bill Curtis, Mary Beth Chrissis In every sense, the CMM represents the best thinking in the field today... this book is targeted at anyone involved in improving the software process, including members of assessment or evaluation teams, members of software engineering process groups, software managers, and software practitioners... From the Foreword by Watts Humphrey The Capability Maturity Model for Software (CMM) is a framework that demonstrates the key elements of an effective software process. The CMM describes an evolutionary improvement path for software development from an ad hoc, immature process to a mature, disciplined process, in a path laid out in five levels. When using the CMM, software professionals in government and industry can develop and improve their ability to identify, adopt, and use sound management and technical practices for delivering quality software on schedule and at a reasonable cost. This book provides a description and technical overview of the CMM, along with guidelines for improving software process management overall. It is a sequel to Watts Humphrey's important work,Managing the Software Process,in that it structures the maturity framework presented in that book more formally. Features: bull; bull;Compares the CMM with ISO 9001 bull;Provides an overview of ISO's SPICE project, which is developing international standards for software process improvement and capability determination bull;Presents a case study of IBM Houston's Space Shuttle project, which is frequently referred to as being at Level 5 0201546647B04062001",http://bks4.books.google.com/books?id=pKZQAAAAMAAJ&printsec=frontcover&img=1&zoom=5&source=gbs_api,http://bks4.books.google.com/books?id=pKZQAAAAMAAJ&printsec=frontcover&img=1&zoom=1&source=gbs_api,http://bks4.books.google.com/books?id=pKZQAAAAMAAJ&printsec=frontcover&img=1&zoom=2&source=gbs_api,http://bks4.books.google.com/books?id=pKZQAAAAMAAJ&printsec=frontcover&img=1&zoom=3&source=gbs_api,http://books.google.com/books?id=pKZQAAAAMAAJ&dq=isbn:9780201546644&hl=&cd=1&source=gbs_api
Software Design,"",David Budgen,9780201722192,QA76.76.D47 B83 2003,2003,"This book provides engineers and programmers with an introduction to the role of design in Software Engineering. The book evaluates popular design methods and compares their strengths and limitations in different applications. Emphasizing the role of design, the book provides an ideal tutorial for software engineers and programmers.",http://bks3.books.google.com/books?id=bnY3vb606bAC&printsec=frontcover&img=1&zoom=5&source=gbs_api,http://bks3.books.google.com/books?id=bnY3vb606bAC&printsec=frontcover&img=1&zoom=1&source=gbs_api,http://bks3.books.google.com/books?id=bnY3vb606bAC&printsec=frontcover&img=1&zoom=2&source=gbs_api,http://bks3.books.google.com/books?id=bnY3vb606bAC&printsec=frontcover&img=1&zoom=3&source=gbs_api,http://books.google.com/books?id=bnY3vb606bAC&dq=isbn:9780201722192&hl=&cd=1&source=gbs_api
Bringing design to software,"",Terry Winograd,9780201854916,QA76.76.D47 B745 1996,1996,"Designing Software Interactions aims to illuminate and stimulate the discipline of software design. Collecting insights and experiences from experts in diverse fields, it addresses the growing demand that the software industry produce software that really works--software that fits people and situations far better than the examples we see today.",http://bks0.books.google.com/books?id=paVQAAAAMAAJ&printsec=frontcover&img=1&zoom=5&source=gbs_api,http://bks0.books.google.com/books?id=paVQAAAAMAAJ&printsec=frontcover&img=1&zoom=1&source=gbs_api,http://bks0.books.google.com/books?id=paVQAAAAMAAJ&printsec=frontcover&img=1&zoom=2&source=gbs_api,http://bks0.books.google.com/books?id=paVQAAAAMAAJ&printsec=frontcover&img=1&zoom=3&source=gbs_api,http://books.google.com/books?id=paVQAAAAMAAJ&dq=isbn:9780201854916&hl=&cd=1&source=gbs_api
Software design,from programming to architecture,Eric J. Braude,9780471204596,QA76.76.D47 B73 2004,2004,"UML (the Unified Modeling Language), design patterns, and software component technologies are three new advances that help software engineers create more efficient and effective software designs. Now Eric Braude pulls these three advances together into one unified presentation: A helpful project threaded throughout the book enables readers to apply what they are learning Presents a modern and applied approach to software design Numerous design patterns with detailed explanations provide essential tools for technical and professional growth Includes extensive discussion of UML with many UML examples",http://bks2.books.google.com/books?id=tKFQAAAAMAAJ&printsec=frontcover&img=1&zoom=5&source=gbs_api,http://bks2.books.google.com/books?id=tKFQAAAAMAAJ&printsec=frontcover&img=1&zoom=1&source=gbs_api,http://bks2.books.google.com/books?id=tKFQAAAAMAAJ&printsec=frontcover&img=1&zoom=2&source=gbs_api,http://bks2.books.google.com/books?id=tKFQAAAAMAAJ&printsec=frontcover&img=1&zoom=3&source=gbs_api,http://books.google.com/books?id=tKFQAAAAMAAJ&dq=isbn:9780471204596&hl=&cd=1&source=gbs_api
Design and Use of Software Architectures,Adopting and Evolving a Product-Line Approach,Jan Bosch,9780201674941,QA76.76.D47 B69 2000,2000,"This book provides an achievable answer. The author proposes a method for designing software architectures, and product line architectures, which is based on his experience in industry and research. The first part of the book introduces the design method,",http://bks8.books.google.com/books?id=7K9QAAAAMAAJ&printsec=frontcover&img=1&zoom=5&source=gbs_api,http://bks8.books.google.com/books?id=7K9QAAAAMAAJ&printsec=frontcover&img=1&zoom=1&source=gbs_api,http://bks8.books.google.com/books?id=7K9QAAAAMAAJ&printsec=frontcover&img=1&zoom=2&source=gbs_api,http://bks8.books.google.com/books?id=7K9QAAAAMAAJ&printsec=frontcover&img=1&zoom=3&source=gbs_api,http://books.google.com/books?id=7K9QAAAAMAAJ&dq=isbn:9780201674941&hl=&cd=1&source=gbs_api
Intermediate Algebra,Models Functions and Graphs,Judy Kysh,9780201571615,QA76.76.D47 B655 1999,1996-09-01,,,,,,http://books.google.com/books?id=oypJAAAACAAJ&dq=isbn:9780201571615&hl=&cd=1&source=gbs_api
Adopting the Rational Unified Process,success with the RUP,"Stefan Bergström, Lotta Råberg",9780321202949,QA76.76.D47 B4578 2004,2004-01-08,"- Helps organizations tackle the complexity of implementation and begin seeing immediate return on their significant RUP investment - Another in a successful line of books from authors at Rational/IBM, and the latest in the acclaimed Object Technology Series - Significant co-marketing opportunities with Rational/IBM",http://bks6.books.google.com/books?id=mKRQAAAAMAAJ&printsec=frontcover&img=1&zoom=5&source=gbs_api,http://bks6.books.google.com/books?id=mKRQAAAAMAAJ&printsec=frontcover&img=1&zoom=1&source=gbs_api,http://bks6.books.google.com/books?id=mKRQAAAAMAAJ&printsec=frontcover&img=1&zoom=2&source=gbs_api,http://bks6.books.google.com/books?id=mKRQAAAAMAAJ&printsec=frontcover&img=1&zoom=3&source=gbs_api,http://books.google.com/books?id=mKRQAAAAMAAJ&dq=isbn:9780321202949&hl=&cd=1&source=gbs_api
Extreme Programming Explained,Embrace Change,Kent Beck,9780201616415,QA76.76.D47 B434 2000,2000,"Beck wants to encourage readers to re-examine their preconceptions of how software development ought to occur. He does just that in this overview of Extreme Programming, a controversial approach to software development which challenges the notion that the cost of changing a piece of software must rise dramatically over the course of time.",http://bks8.books.google.com/books?id=G8EL4H4vf7UC&printsec=frontcover&img=1&zoom=5&edge=none&source=gbs_api,http://bks8.books.google.com/books?id=G8EL4H4vf7UC&printsec=frontcover&img=1&zoom=1&edge=none&source=gbs_api,http://bks8.books.google.com/books?id=G8EL4H4vf7UC&printsec=frontcover&img=1&zoom=2&edge=none&source=gbs_api,http://bks8.books.google.com/books?id=G8EL4H4vf7UC&printsec=frontcover&img=1&zoom=3&edge=none&source=gbs_api,http://books.google.com/books?id=G8EL4H4vf7UC&printsec=frontcover&dq=isbn:9780201616415&hl=&cd=1&source=gbs_api
Planning Extreme Programming,"",Kent Beck,9780201710915,QA76.76.D47 B4335 2001,2001,"A guide to XP leads the developer, project manager, and team leader through the software development planning process, offering real world examples and tips for reacting to changing environments quickly and efficiently.",http://bks5.books.google.com/books?id=u13hVoYVZa8C&printsec=frontcover&img=1&zoom=5&edge=none&source=gbs_api,http://bks5.books.google.com/books?id=u13hVoYVZa8C&printsec=frontcover&img=1&zoom=1&edge=none&source=gbs_api,http://bks5.books.google.com/books?id=u13hVoYVZa8C&printsec=frontcover&img=1&zoom=2&edge=none&source=gbs_api,http://bks5.books.google.com/books?id=u13hVoYVZa8C&printsec=frontcover&img=1&zoom=3&edge=none&source=gbs_api,http://books.google.com/books?id=u13hVoYVZa8C&printsec=frontcover&dq=isbn:9780201710915&hl=&cd=1&source=gbs_api
A practical guide to eXtreme programming,"","David Astels, Granville Miller, Miroslav Michal Novak",9780130674821,QA76.76.D47 A88 2002,2002-02-01,"Appropriate for any course on software engineering methodologies, especially courses on XP, or 'agile' and/or 'light' methodologies. XP is rapidly becoming the world's most popular agile methodology. Now, there's a readable, concise guide that brings together all the guidance and best practices students need to succeed with XP. The authors begin by introducing the key practices that developers must take to heart in order to make XP work, and the key players in an XP project - including developers, managers, and customers. They demonstrate how to create a vision of any proposed software system, write effective user stories and acceptance tests, and plan for regular releases and iterations. They present best practices for XP testing, 'coding with intention', integration, and refactoring, showing how to overcome key challenges early XP implementers have encountered, and achieve the powerful benefits XP can provide.",http://bks4.books.google.com/books?id=fIc_AQAAIAAJ&printsec=frontcover&img=1&zoom=5&source=gbs_api,http://bks4.books.google.com/books?id=fIc_AQAAIAAJ&printsec=frontcover&img=1&zoom=1&source=gbs_api,http://bks4.books.google.com/books?id=fIc_AQAAIAAJ&printsec=frontcover&img=1&zoom=2&source=gbs_api,http://bks4.books.google.com/books?id=fIc_AQAAIAAJ&printsec=frontcover&img=1&zoom=3&source=gbs_api,http://books.google.com/books?id=fIc_AQAAIAAJ&dq=isbn:9780130674821&hl=&cd=1&source=gbs_api
Aspect-oriented software development,"",Robert E. Filman,9780321219763,QA76.76.D47 A87 2005,2005,The definitive reference on the emerging and dynamic field of Aspect - Oriented Software Development (AOSD).,http://bks2.books.google.com/books?id=_nYZAQAAIAAJ&printsec=frontcover&img=1&zoom=5&source=gbs_api,http://bks2.books.google.com/books?id=_nYZAQAAIAAJ&printsec=frontcover&img=1&zoom=1&source=gbs_api,http://bks2.books.google.com/books?id=_nYZAQAAIAAJ&printsec=frontcover&img=1&zoom=2&source=gbs_api,http://bks2.books.google.com/books?id=_nYZAQAAIAAJ&printsec=frontcover&img=1&zoom=3&source=gbs_api,http://books.google.com/books?id=_nYZAQAAIAAJ&dq=isbn:9780321219763&hl=&cd=1&source=gbs_api
Extreme Programming Applied,Playing to Win,"Ken Auer, Roy W. Miller",9780201616408,QA76.76.D47 A84 2002,2002,"The complete guide to applying XP -- today's fastest growing software methodology! -- Covers all stages of the development lifecycle: design, testing, implementation, and deployment. -- How to apply all four key XP values: simplicity, communication, feedback, and courage. -- Mastering the discipline XP's soft methodology demands. Extreme Programming (XP) is a fundamentally different way to create software: simple, yet disciplined, lightweight yet powerful, flexible yet rigorous. It's catching on like wildfire, as developers who try it discover not only its effectiveness, but the pleasure it returns to their work. Extreme Programming Applied is the place to start for any developer or project manager preparing to use XP for the first time. In this book, two pioneers in XP practice offer a complete introduction to applying XP at all stages of the software development lifecycle -- design, testing, implementation, and deployment. They introduce XP's key principles in the context of actual development challenges, explaining why XP's soft approach is more appropriate to software development than the civil engineering paradigms that are so widespread nowadays. This book goes beyond explaining XP's elements: it shows how the pieces fit together, demonstrating exactly how to make XP work for real projects in real organizations. For all project managers, developers, software engineers, and others interested in more effective, flexible approaches to software development.",http://bks9.books.google.com/books?id=JHtxQgAACAAJ&printsec=frontcover&img=1&zoom=5&source=gbs_api,http://bks9.books.google.com/books?id=JHtxQgAACAAJ&printsec=frontcover&img=1&zoom=1&source=gbs_api,http://bks9.books.google.com/books?id=JHtxQgAACAAJ&printsec=frontcover&img=1&zoom=2&source=gbs_api,http://bks9.books.google.com/books?id=JHtxQgAACAAJ&printsec=frontcover&img=1&zoom=3&source=gbs_api,http://books.google.com/books?id=JHtxQgAACAAJ&dq=isbn:9780201616408&hl=&cd=1&source=gbs_api
Enterprise Patterns and MDA,Building Better Software with Archetype Patterns and UML,"Jim Arlow, Ila Neustadt",9780321112309,QA76.76.D47 A735 2004,2004,& A proven catalogue of reusable solutions to commonly occurring problems in business software design & & Allows readers to communicate UML models to the broadest possible audience & & Cutting-edge techniques to leverage the significant power of MDA and the latest version of UML (2.0),http://bks5.books.google.com/books?id=NefmonGgEEMC&printsec=frontcover&img=1&zoom=5&edge=none&source=gbs_api,http://bks5.books.google.com/books?id=NefmonGgEEMC&printsec=frontcover&img=1&zoom=1&edge=none&source=gbs_api,http://bks5.books.google.com/books?id=NefmonGgEEMC&printsec=frontcover&img=1&zoom=2&edge=none&source=gbs_api,http://bks5.books.google.com/books?id=NefmonGgEEMC&printsec=frontcover&img=1&zoom=3&edge=none&source=gbs_api,http://books.google.com/books?id=NefmonGgEEMC&printsec=frontcover&dq=isbn:9780321112309&hl=&cd=1&source=gbs_api
The Elements of UML- 2.0 Style,"",Scott W. Ambler,9780521616782,QA76.76.D47 A4258 2005,2005-05-09,Concise and easy-to-understand guidelines and standards for creating UML 2.0 diagrams.,http://bks5.books.google.com/books?id=BdYLAQAAQBAJ&printsec=frontcover&img=1&zoom=5&edge=none&source=gbs_api,http://bks5.books.google.com/books?id=BdYLAQAAQBAJ&printsec=frontcover&img=1&zoom=1&edge=none&source=gbs_api,http://bks5.books.google.com/books?id=BdYLAQAAQBAJ&printsec=frontcover&img=1&zoom=2&edge=none&source=gbs_api,http://bks5.books.google.com/books?id=BdYLAQAAQBAJ&printsec=frontcover&img=1&zoom=3&edge=none&source=gbs_api,http://books.google.com/books?id=BdYLAQAAQBAJ&printsec=frontcover&dq=isbn:9780521616782&hl=&cd=1&source=gbs_api
Java Design,"Objects, UML, and Process",Kirk Knoernschild,9780201750447,QA76.73.J38 K57 2002,2002,"A systematic approach to striving for perfection in Java TM enterprise software! -- Principles and best-practice patterns for the key design and implementation problems facing enterprise developers. -- Effective integration of UML, object-oriented development, Java TM, and your software development processes. -- Identifies behavioral and structural modeling techniques that deliver exceptional value. Drawing upon the experiences of hundreds of developers he has trained or worked with, Kirk Knoernschild offers a systematic guide to solving today's complex problems of Java-based enterprise application design and implementation. Knoernschild focuses on both technology and process, offering a phased approach to integrating UML, object-oriented development, and Java TM throughout the entire development lifecycle. Knoernschild begins by reintroducing objects and object-oriented design, presenting key concepts such as polymorphism and inheritance in terms of several powerful principles and patterns that inform the entire book. Next, he introduces the UML: how it evolved, the problems it helps to solve, and how various UML constructs can be mapped to Java. Knoernschild shows how to structure UML diagrams to more easily identify the problem being solved, introduces best practices that any software development process should promote, and shows how the UML fits with these best practices. He reviews the external considerations that impact how companies really use the UML, Java TM, and object-based techniques, presenting a pragmatic, phased approach to integrating them with the least pain and the greatest effectiveness. The book concludes with in-depth coverage of behavioral andstructural modeling, again emphasizing the principles and patterns associated with long-term success. For every Java TM enterprise developer, architect, analyst, and project manager.",http://bks1.books.google.com/books?id=4pjbgVHzomsC&printsec=frontcover&img=1&zoom=5&edge=none&source=gbs_api,http://bks1.books.google.com/books?id=4pjbgVHzomsC&printsec=frontcover&img=1&zoom=1&edge=none&source=gbs_api,http://bks1.books.google.com/books?id=4pjbgVHzomsC&printsec=frontcover&img=1&zoom=2&edge=none&source=gbs_api,http://bks1.books.google.com/books?id=4pjbgVHzomsC&printsec=frontcover&img=1&zoom=3&edge=none&source=gbs_api,http://books.google.com/books?id=4pjbgVHzomsC&printsec=frontcover&dq=isbn:9780201750447&hl=&cd=1&source=gbs_api
The Elements of Java(TM) Style,"",Al Vermeulen,9780521777681,QA76.73.J38 E43 2000,2000-01-28,Illustrates rules of Java code-writing with parallel examples of correct and incorrect usage.,http://bks8.books.google.com/books?id=Z2CKvVZjPPEC&printsec=frontcover&img=1&zoom=5&edge=none&source=gbs_api,http://bks8.books.google.com/books?id=Z2CKvVZjPPEC&printsec=frontcover&img=1&zoom=1&edge=none&source=gbs_api,http://bks8.books.google.com/books?id=Z2CKvVZjPPEC&printsec=frontcover&img=1&zoom=2&edge=none&source=gbs_api,http://bks8.books.google.com/books?id=Z2CKvVZjPPEC&printsec=frontcover&img=1&zoom=3&edge=none&source=gbs_api,http://books.google.com/books?id=Z2CKvVZjPPEC&printsec=frontcover&dq=isbn:9780521777681&hl=&cd=1&source=gbs_api
Thinking in Java,"",Bruce Eckel,9780131872486,QA76.73.J38 E25 2006,2006,This 4th edition of 'Thinking in Java' has been updated to include verion J2SE 5.0.,http://bks7.books.google.com/books?id=bQVvAQAAQBAJ&printsec=frontcover&img=1&zoom=5&edge=none&source=gbs_api,http://bks7.books.google.com/books?id=bQVvAQAAQBAJ&printsec=frontcover&img=1&zoom=1&edge=none&source=gbs_api,http://bks7.books.google.com/books?id=bQVvAQAAQBAJ&printsec=frontcover&img=1&zoom=2&edge=none&source=gbs_api,http://bks7.books.google.com/books?id=bQVvAQAAQBAJ&printsec=frontcover&img=1&zoom=3&edge=none&source=gbs_api,http://books.google.com/books?id=bQVvAQAAQBAJ&printsec=frontcover&dq=isbn:9780131872486&hl=&cd=1&source=gbs_api
