Title,Subtitle,Authors,ISBN,LCC,Publish Date,Description,Thumbnail,Small,Medium,Large,Preview
TeX for the beginner,"",Wynter Snow,9780201547993,Z253.4.T47 S64 1992,1992,"TEX is now widely used for computer typesetting in mathematics, science, and engineering. This book is a carefully paced, tutorial introduction for people first learning the system. Special emphasis is given to what can go wrong, and how to fix things. LATEX notes are provided for use with a set of macros. Features First book about TEX that is really for beginners. Shows the reader not only what TEX is, but how to use it. Teaches the reader how to write simple macros for all major formatting tasks. Covers typesetting of mathematics, includes conditionals, and auxiliary files, and describes TEX's boxes and rules. Contains tips on diagnosing bugs, and fixing line and page breaks, along with useful reference material. 0201547996B04062001",http://bks7.books.google.com/books?id=vys8AQAAIAAJ&printsec=frontcover&img=1&zoom=5&source=gbs_api,http://bks7.books.google.com/books?id=vys8AQAAIAAJ&printsec=frontcover&img=1&zoom=1&source=gbs_api,http://bks7.books.google.com/books?id=vys8AQAAIAAJ&printsec=frontcover&img=1&zoom=2&source=gbs_api,http://bks7.books.google.com/books?id=vys8AQAAIAAJ&printsec=frontcover&img=1&zoom=3&source=gbs_api,http://books.google.com/books?id=vys8AQAAIAAJ&dq=isbn:9780201547993&hl=&cd=1&source=gbs_api
A guide to LATEX,a document preparation for beginners and advanced users,Helmut Kopka,9780201568899,Z253.4.L38 K66 1993,1993-01,,,,,,http://books.google.com/books?id=hMRkQgAACAAJ&dq=isbn:9780201568899&hl=&cd=1&source=gbs_api
Privacy on the Line,The Politics of Wiretapping and Encryption,"Whitfield Diffie, Susan Eva Landau",9780262042406,UB256.U6 D54 2007,2007,"Telecommunication has never been perfectly secure. The Cold War culture of recordingdevices in telephone receivers and bugged embassy offices has been succeeded by a post-9/11 world ofNSA wiretaps and demands for data retention. Although the 1990s battle for individual and commercialfreedom to use cryptography was won, growth in the use of cryptography has been slow. Meanwhile,regulations requiring that the computer and communication industries build spying into their systemsfor government convenience have increased rapidly. The application of the 1994 CommunicationsAssistance for Law Enforcement Act has expanded beyond the intent of Congress to apply to voice overInternet Protocol (VoIP) and other modern data services; attempts are being made to require ISPs toretain their data for years in case the government wants it; and data mining techniques developedfor commercial marketing applications are being applied to widespread surveillance of thepopulation. In Privacy on the Line, Whitfield Diffie and SusanLandau strip away the hype surrounding the policy debate over privacy to examine the nationalsecurity, law enforcement, commercial, and civil liberties issues. They discuss the social functionof privacy, how it underlies a democratic society, and what happens when it is lost. This updatedand expanded edition revises their original -- and prescient -- discussions of both policy andtechnology in light of recent controversies over NSA spying and other government threats tocommunications privacy.",http://bks7.books.google.com/books?id=nMY8yHaTQi4C&printsec=frontcover&img=1&zoom=5&edge=none&source=gbs_api,http://bks7.books.google.com/books?id=nMY8yHaTQi4C&printsec=frontcover&img=1&zoom=1&edge=none&source=gbs_api,http://bks7.books.google.com/books?id=nMY8yHaTQi4C&printsec=frontcover&img=1&zoom=2&edge=none&source=gbs_api,http://bks7.books.google.com/books?id=nMY8yHaTQi4C&printsec=frontcover&img=1&zoom=3&edge=none&source=gbs_api,http://books.google.com/books?id=nMY8yHaTQi4C&printsec=frontcover&dq=isbn:9780262042406&hl=&cd=1&source=gbs_api
Cartographies Of Disease,"Maps, Mapping, And Medicine",Tom Koch,9781589481206,RA792.5.K63 2005,2005,"A comprehensive survey of the technology of mapping and its relationship to the battle against disease, this look at medical mapping advances a radical argument that maps are not merely representations of spatial realities but a way of thinking about relations between viral and bacterial communities, human hosts, and the environments in which diseases flourish. The history of medical mapping is traced--from its growth in the 19th century during an era of trade and immigration to its renaissance in the 1990s during a new era of globalization. Referencing maps older than John Snow's famous cholera maps of London in the mid-19th century, this survey pulls from the plague maps of the 1600s, while addressing current issues concerning the ability of GIS technology to track diseases worldwide.",http://bks7.books.google.com/books?id=wrZxQgAACAAJ&printsec=frontcover&img=1&zoom=5&source=gbs_api,http://bks7.books.google.com/books?id=wrZxQgAACAAJ&printsec=frontcover&img=1&zoom=1&source=gbs_api,http://bks7.books.google.com/books?id=wrZxQgAACAAJ&printsec=frontcover&img=1&zoom=2&source=gbs_api,http://bks7.books.google.com/books?id=wrZxQgAACAAJ&printsec=frontcover&img=1&zoom=3&source=gbs_api,http://books.google.com/books?id=wrZxQgAACAAJ&dq=isbn:9781589481206&hl=&cd=1&source=gbs_api
Agile manufacturing,forging new frontiers,Paul T. Kidd,9780201631630,TS176.K513 1994,1994,What is Agile manufacturing? Can it really enable the West to gain competitive advantage over Japan? This book sets out to define Agile Manufacturing and to dispel some of the mistaken beliefs that surround it.,http://bks1.books.google.com/books?id=wexTAAAAMAAJ&printsec=frontcover&img=1&zoom=5&source=gbs_api,http://bks1.books.google.com/books?id=wexTAAAAMAAJ&printsec=frontcover&img=1&zoom=1&source=gbs_api,http://bks1.books.google.com/books?id=wexTAAAAMAAJ&printsec=frontcover&img=1&zoom=2&source=gbs_api,http://bks1.books.google.com/books?id=wexTAAAAMAAJ&printsec=frontcover&img=1&zoom=3&source=gbs_api,http://books.google.com/books?id=wexTAAAAMAAJ&dq=isbn:9780201631630&hl=&cd=1&source=gbs_api
Bit-slice Microprocessor Design,"",John Mick,9780070417816,TK7895.M5 M44,1980,Computer Systems Organization -- Computer System Implementation.,http://bks2.books.google.com/books?id=dQcjAAAAMAAJ&printsec=frontcover&img=1&zoom=5&source=gbs_api,http://bks2.books.google.com/books?id=dQcjAAAAMAAJ&printsec=frontcover&img=1&zoom=1&source=gbs_api,http://bks2.books.google.com/books?id=dQcjAAAAMAAJ&printsec=frontcover&img=1&zoom=2&source=gbs_api,http://bks2.books.google.com/books?id=dQcjAAAAMAAJ&printsec=frontcover&img=1&zoom=3&source=gbs_api,http://books.google.com/books?id=dQcjAAAAMAAJ&dq=isbn:9780070417816&hl=&cd=1&source=gbs_api
Embedded System Design,A Unified Hardware/Software Introduction,"Frank Vahid, Tony D. Givargis",9780471386780,TK7895.E42 V33 2002,2001-10-17,"This book introduces a modern approach to embedded system design, presenting software design and hardware design in a unified manner. It covers trends and challenges, introduces the design and use of single-purpose processors (hardware) and general-purpose processors (software), describes memories and buses, illustrates hardware/software tradeoffs using a digital camera example, and discusses advanced computation models, controls systems, chip technologies, and modern design tools. For courses found in EE, CS and other engineering departments.",http://bks4.books.google.com/books?id=0ZW6QgAACAAJ&printsec=frontcover&img=1&zoom=5&source=gbs_api,http://bks4.books.google.com/books?id=0ZW6QgAACAAJ&printsec=frontcover&img=1&zoom=1&source=gbs_api,http://bks4.books.google.com/books?id=0ZW6QgAACAAJ&printsec=frontcover&img=1&zoom=2&source=gbs_api,http://bks4.books.google.com/books?id=0ZW6QgAACAAJ&printsec=frontcover&img=1&zoom=3&source=gbs_api,http://books.google.com/books?id=0ZW6QgAACAAJ&dq=isbn:9780471386780&hl=&cd=1&source=gbs_api
Fundamentals of Embedded Software,Where C and Assembly Meet,Daniel Wesley Lewis,9780130615893,TK7895.E42 L49 2002,2002,"Reflecting current industrial applications and programming practice, this book lays a foundation that supports the multi-threaded style of programming and high-reliability requirements of embedded software. Using a non-product specific approach and a programming (versus hardware) perspective, it focuses on the 32-bit protected mode processors and on C as the dominant programming language--with coverage of Assembly and how it can be used in conjunction with, and support of, C. Features an abundance of examples in C and an accompanying CD-ROM with software tools. Data Representation. Getting the Most Out of C. A Programmer's View of Computer Organization. Mixing C and Assembly. Input/Output Programming. Concurrent Software. Scheduling. Memory Management. Shared Memory. System Initialization. For Computer Scientists, Computer Engineers, and Electrical Engineers involved with embedded software applications.",http://bks2.books.google.com/books?id=rS-uQgAACAAJ&printsec=frontcover&img=1&zoom=5&source=gbs_api,http://bks2.books.google.com/books?id=rS-uQgAACAAJ&printsec=frontcover&img=1&zoom=1&source=gbs_api,http://bks2.books.google.com/books?id=rS-uQgAACAAJ&printsec=frontcover&img=1&zoom=2&source=gbs_api,http://bks2.books.google.com/books?id=rS-uQgAACAAJ&printsec=frontcover&img=1&zoom=3&source=gbs_api,http://books.google.com/books?id=rS-uQgAACAAJ&dq=isbn:9780130615893&hl=&cd=1&source=gbs_api
Logic and Computer Design Fundamentals,"","M. Morris Mano, Charles R. Kime",9780130314864,TK7888.4.M36 2004,2001,,http://bks6.books.google.com/books?id=W8G7mQEACAAJ&printsec=frontcover&img=1&zoom=5&source=gbs_api,http://bks6.books.google.com/books?id=W8G7mQEACAAJ&printsec=frontcover&img=1&zoom=1&source=gbs_api,http://bks6.books.google.com/books?id=W8G7mQEACAAJ&printsec=frontcover&img=1&zoom=2&source=gbs_api,http://bks6.books.google.com/books?id=W8G7mQEACAAJ&printsec=frontcover&img=1&zoom=3&source=gbs_api,http://books.google.com/books?id=W8G7mQEACAAJ&dq=isbn:9780130314864&hl=&cd=1&source=gbs_api
Effective Methods for Software Testing,"",William E. Perry,9780471354185,QA76.76.T48 P46 2000,2000-02-07,"All the proven testing tools and techniques you'll need to ensure that your applications work exactly as they're supposed to! Effective Methods for Software Testing Second Edition Can you guarantee that the software your company develops works as intended? It's essential that you know the proper techniques for testing software, otherwise you could face lost productivity, lost revenue, and customer dissatisfaction. Leading software testing expert William Perry takes you through a comprehensive eleven-step testing process that contains all of the components you'll need to evaluate your software. This testing process includes numerous workpapers and checklists designed to lead you through all aspects of software testing and can be customized to meet the needs of your organization or for a specific test assignment. From establishing a test strategy to selecting and using testing tools, you'll also find helpful guidelines on how to build an effective testing environment. This includes self-assessments designed to improve deficient capabilities of your software development process and deficient competencies of software testers. Detailed test programs featured in this Second Edition include: * Internet/Intranet applications * Off-the-shelf software * Multiplatform environments * System security * Data warehouse applications * Client/server systems * Rapid application development Short on theory and long on nuts-and-bolts guidance, Effective Methods for Software Testing, Second Edition arms you with what you need to guarantee that your customers get what they deserve-the most usable, bug-free software possible. The companion Web site at www.wiley.com/compbooks/perry/features: * Current software testing survey results * An extensive list of software testing techniques * A case study on how this book can be turned into an in-house testing manual Wiley Computer Publishing Timely. Practical. Reliable. Visit out Web site at www.wiley.com/compbooks/",http://bks0.books.google.com/books?id=KaFlQgAACAAJ&printsec=frontcover&img=1&zoom=5&source=gbs_api,http://bks0.books.google.com/books?id=KaFlQgAACAAJ&printsec=frontcover&img=1&zoom=1&source=gbs_api,http://bks0.books.google.com/books?id=KaFlQgAACAAJ&printsec=frontcover&img=1&zoom=2&source=gbs_api,http://bks0.books.google.com/books?id=KaFlQgAACAAJ&printsec=frontcover&img=1&zoom=3&source=gbs_api,http://books.google.com/books?id=KaFlQgAACAAJ&dq=isbn:9780471354185&hl=&cd=1&source=gbs_api
Software testing,"",Ron Patton,9780672319839,QA76.76.T48 P38 2001,2001,"Software Testing is the book for new or aspiring software testers interested in learning about this crucial part of the software development process. The complexity and size of today's software makes writing bug-free code extremely difficult, even for highly experienced programmers. Couple that with our increasing reliance on software for performing everyday tasks and its pervasiveness in the medical, telecommunications, manufacturing, and financial industries, and a software bug can spell disaster. Quality software can't be created with an ad- hoc, part-time, bug hunt. It requires a methodical and disciplined approach to preventing, finding, and reporting bugs. Software Testing will show you what it takes to be a successful software tester, assuring that you discover those nasty bugs before your customers do.",http://bks0.books.google.com/books?id=8rJQAAAAMAAJ&printsec=frontcover&img=1&zoom=5&source=gbs_api,http://bks0.books.google.com/books?id=8rJQAAAAMAAJ&printsec=frontcover&img=1&zoom=1&source=gbs_api,http://bks0.books.google.com/books?id=8rJQAAAAMAAJ&printsec=frontcover&img=1&zoom=2&source=gbs_api,http://bks0.books.google.com/books?id=8rJQAAAAMAAJ&printsec=frontcover&img=1&zoom=3&source=gbs_api,http://books.google.com/books?id=8rJQAAAAMAAJ&dq=isbn:9780672319839&hl=&cd=1&source=gbs_api
Best practices for the formal software testing process,a menu of testing tasks,Rodger Drabick,9780932633583,QA76.76.T48 D73 2004,2004-12-01,"How to Use the Formal Testing Process Model. There is no one true way to test software, so the goal of this book is to provide you with a structure and set of best practices that you can use to develop a formal testing process that fits your needs, and those of your customers, your management, and your organization. You should consider this book as a menu of things you could do, and then establish a set of priorities for what you'll do first, what you'll do second, and so on. As an example, suppose you are working in a test engineering role in a company in which the current practice is that when executive management gets an idea for a new application to add to the software suite your company produces, the following happens: First, management assigns a developer to the task; then, the developer takes the limited input from management and writes code for the application. Thus, in such an environment, the entire requirements and design process is minimized at best, and short-circuited at worst. When code is complete, as far as the developer is concerned (and we'll believe that he or she did some limited unit testing based on an understanding of the requirements), the developer hands the code to the test engineer he or she is most comfortable working with, or to the team leader of testing. This may well be the first time that the folks involved in testing have heard about this new or upgraded application. If you're in the role of testing team leader or test engineer, what good does the model in this book do you? In this specific instance, I'd advise you to look carefully at the Perform Formal Test process (see figure below). Consider which of the five subprocesses (Hold Pretest Meeting,Execute Test, Determine Disposition of Incidents, Hold Posttest Meeting, or Write Test Report) you are currently performing. I suspect that, in the environment I've postulated, your group is only performing the Execute Test and Determine Disposition of Incidents subprocesses. It would not be difficult to start holding pretest and posttest meetings, and these could markedly improve your process. At the pretest meeting, you should ask the developer to describe the unit and integration testing performed and to identify areas of risk. The personnel assigned to testing can then concentrate on these risk areas. In such an environment, there probably hasn't been time to develop a test plan or test design, but what would you base the plan or design on, anyway? Test cases or test procedures will have been developed based on discussions with the developer and the development team lead or manager. These can also be reviewed at the pretest meeting for adequacy. This could turn out to be a long meeting for a complex application. You might want to schedule a test-case and test-procedure review meeting prior to the pretest meeting. Peer reviews of test documentation are always a good idea, and the earlier they can be held, the better the return. As part of the Perform Formal Test process, you should also make sure you have some sort of tool or process in place to record defects discovered in testing, a process to present them to the developers, a process to incorporate the fixes, and a process to regression-test the application to make sure that the fixes work (and, perhaps equally important, that they don't break something else).",http://bks1.books.google.com/books?id=9OwJAQAAMAAJ&printsec=frontcover&img=1&zoom=5&source=gbs_api,http://bks1.books.google.com/books?id=9OwJAQAAMAAJ&printsec=frontcover&img=1&zoom=1&source=gbs_api,http://bks1.books.google.com/books?id=9OwJAQAAMAAJ&printsec=frontcover&img=1&zoom=2&source=gbs_api,http://bks1.books.google.com/books?id=9OwJAQAAMAAJ&printsec=frontcover&img=1&zoom=3&source=gbs_api,http://books.google.com/books?id=9OwJAQAAMAAJ&dq=isbn:9780932633583&hl=&cd=1&source=gbs_api
Rapid testing,"","Robert Culbertson, Chris Brown, Gary Cobb",9780130912947,QA76.76.T48 C85 2002,2002,"Rapid Testingaddresses the growing need for constant, early, and efficient testing in today's fast-paced software development environment. Covers all aspects of testing, including bug tracking and reporting, verification and validation, test planning, test design and development, metrics, effort estimation, and reporting.",http://bks5.books.google.com/books?id=Nb9QAAAAMAAJ&printsec=frontcover&img=1&zoom=5&source=gbs_api,http://bks5.books.google.com/books?id=Nb9QAAAAMAAJ&printsec=frontcover&img=1&zoom=1&source=gbs_api,http://bks5.books.google.com/books?id=Nb9QAAAAMAAJ&printsec=frontcover&img=1&zoom=2&source=gbs_api,http://bks5.books.google.com/books?id=Nb9QAAAAMAAJ&printsec=frontcover&img=1&zoom=3&source=gbs_api,http://books.google.com/books?id=Nb9QAAAAMAAJ&dq=isbn:9780130912947&hl=&cd=1&source=gbs_api
Introduction to Software Testing,"","Paul Ammann, Jeff Offutt",9780521880381,QA76.76.T48 A56 2008,2008-01-28,"Teaches students an innovative and successful approach to software testing. Resources for instructors (e.g. PowerPoint slides, solutions) on supporting website.",http://bks9.books.google.com/books?id=leokXF8pLY0C&printsec=frontcover&img=1&zoom=5&edge=none&source=gbs_api,http://bks9.books.google.com/books?id=leokXF8pLY0C&printsec=frontcover&img=1&zoom=1&edge=none&source=gbs_api,http://bks9.books.google.com/books?id=leokXF8pLY0C&printsec=frontcover&img=1&zoom=2&edge=none&source=gbs_api,http://bks9.books.google.com/books?id=leokXF8pLY0C&printsec=frontcover&img=1&zoom=3&edge=none&source=gbs_api,http://books.google.com/books?id=leokXF8pLY0C&printsec=frontcover&dq=isbn:9780521880381&hl=&cd=1&source=gbs_api
Managing software acquisition,open sytems and COTS products,"B. Craig Meyers, Patricia Oberndorf",9780201704549,QA76.76.S95 M49 2001,2001-07-12,"This title looks at strategies for reducing IT costs and improving quality, including open systems and off-the-shelf software. It explains the advantages, risks, and management implications of IT strategies based on these approaches.",http://bks6.books.google.com/books?id=BbZQAAAAMAAJ&printsec=frontcover&img=1&zoom=5&source=gbs_api,http://bks6.books.google.com/books?id=BbZQAAAAMAAJ&printsec=frontcover&img=1&zoom=1&source=gbs_api,http://bks6.books.google.com/books?id=BbZQAAAAMAAJ&printsec=frontcover&img=1&zoom=2&source=gbs_api,http://bks6.books.google.com/books?id=BbZQAAAAMAAJ&printsec=frontcover&img=1&zoom=3&source=gbs_api,http://books.google.com/books?id=BbZQAAAAMAAJ&dq=isbn:9780201704549&hl=&cd=1&source=gbs_api
Open Source .Net development,"",Brian Nantz,9780321228109,QA76.76.S46 N36 2005,2005,Provides information on .NET development in an open source environment.,http://bks6.books.google.com/books?id=eI1QAAAAMAAJ&printsec=frontcover&img=1&zoom=5&source=gbs_api,http://bks6.books.google.com/books?id=eI1QAAAAMAAJ&printsec=frontcover&img=1&zoom=1&source=gbs_api,http://bks6.books.google.com/books?id=eI1QAAAAMAAJ&printsec=frontcover&img=1&zoom=2&source=gbs_api,http://bks6.books.google.com/books?id=eI1QAAAAMAAJ&printsec=frontcover&img=1&zoom=3&source=gbs_api,http://books.google.com/books?id=eI1QAAAAMAAJ&dq=isbn:9780321228109&hl=&cd=1&source=gbs_api
Open Source,Technology and Policy,"Fadi P. Deek, James A. M. McHugh",9780521707411,QA76.76.S46 D44 2008,2007-11-05,"The open source movement is a worldwide effort to promote an open style of software development more aligned with the accepted intellectual style of science than the proprietary modes of invention that have been characteristic of modern business. The idea is to keep the scientific advances created by software development openly available for everyone to use, understand, and improve. The very process of open source creation is highly transparent. This book addresses prominent projects in the open source movement, along with its enabling technologies, social characteristics, legal issues, business venues, and public and educational roles.",http://bks8.books.google.com/books?id=wG_FQgAACAAJ&printsec=frontcover&img=1&zoom=5&source=gbs_api,http://bks8.books.google.com/books?id=wG_FQgAACAAJ&printsec=frontcover&img=1&zoom=1&source=gbs_api,http://bks8.books.google.com/books?id=wG_FQgAACAAJ&printsec=frontcover&img=1&zoom=2&source=gbs_api,http://bks8.books.google.com/books?id=wG_FQgAACAAJ&printsec=frontcover&img=1&zoom=3&source=gbs_api,http://books.google.com/books?id=wG_FQgAACAAJ&dq=isbn:9780521707411&hl=&cd=1&source=gbs_api
Proceedings of the First ACM SIGSOFT Workshop on Self-Healing Systems (WOSS '02),"November 18-19, 2002, Charleston, South Carolina, USA","David Garlan, Jeff Kramer, Alexander L. Wolf",9781581136098,QA76.76.S375 W67 2002,2002-01-01,,,,,,http://books.google.com/books?id=HHWyXwAACAAJ&dq=isbn:9781581136098&hl=&cd=1&source=gbs_api
Software Reuse,Emerging Technology : Tutorial,"",9780818608469,QA76.76.R47.T87 1988,1988,,,,,,http://books.google.com/books?id=5IaWnQEACAAJ&dq=isbn:9780818608469&hl=&cd=1&source=gbs_api
Tutorial,Software Reusability,Peter Freeman,9780818607509,QA76.76.R47.T87 1987,1987,Published by IEEE Computer Society Press.,http://bks1.books.google.com/books?id=edFWAAAAMAAJ&printsec=frontcover&img=1&zoom=5&source=gbs_api,http://bks1.books.google.com/books?id=edFWAAAAMAAJ&printsec=frontcover&img=1&zoom=1&source=gbs_api,http://bks1.books.google.com/books?id=edFWAAAAMAAJ&printsec=frontcover&img=1&zoom=2&source=gbs_api,http://bks1.books.google.com/books?id=edFWAAAAMAAJ&printsec=frontcover&img=1&zoom=3&source=gbs_api,http://books.google.com/books?id=edFWAAAAMAAJ&dq=isbn:9780818607509&hl=&cd=1&source=gbs_api
Software Reusability: Applications and experience,"","Ted J. Biggerstaff, Alan J. Perlis",9780201500189,QA76.76.R47 S64 1989,1989,Volume 2.,http://bks2.books.google.com/books?id=PkoPAQAAMAAJ&printsec=frontcover&img=1&zoom=5&source=gbs_api,http://bks2.books.google.com/books?id=PkoPAQAAMAAJ&printsec=frontcover&img=1&zoom=1&source=gbs_api,http://bks2.books.google.com/books?id=PkoPAQAAMAAJ&printsec=frontcover&img=1&zoom=2&source=gbs_api,http://bks2.books.google.com/books?id=PkoPAQAAMAAJ&printsec=frontcover&img=1&zoom=3&source=gbs_api,http://books.google.com/books?id=PkoPAQAAMAAJ&dq=isbn:9780201500189&hl=&cd=1&source=gbs_api
Software Reusability: Concepts and models,"",Ted J. Biggerstaff,9780201080179,QA76.76.R47 S64 1989,1989,Volume 1.,http://bks6.books.google.com/books?id=VWFOAQAAIAAJ&printsec=frontcover&img=1&zoom=5&source=gbs_api,http://bks6.books.google.com/books?id=VWFOAQAAIAAJ&printsec=frontcover&img=1&zoom=1&source=gbs_api,http://bks6.books.google.com/books?id=VWFOAQAAIAAJ&printsec=frontcover&img=1&zoom=2&source=gbs_api,http://bks6.books.google.com/books?id=VWFOAQAAIAAJ&printsec=frontcover&img=1&zoom=3&source=gbs_api,http://books.google.com/books?id=VWFOAQAAIAAJ&dq=isbn:9780201080179&hl=&cd=1&source=gbs_api
Software Reuse,Domain Analysis and Design Processes,"Jag Sodhi, Prince Sodhi",9780070579231,QA76.76.R47 S63 1999,1999,"Large-scale software systems used by government and corporations - they are anything but simple, but object-oriented programming has made these systems far easier to manage through software reuse. Now comes a trailblazing resource that goes a long way in simplifying the process of software reuse itself: Software Reuse: Doamin Analysis and Design Processes.",http://bks4.books.google.com/books?id=2Q9mQgAACAAJ&printsec=frontcover&img=1&zoom=5&source=gbs_api,http://bks4.books.google.com/books?id=2Q9mQgAACAAJ&printsec=frontcover&img=1&zoom=1&source=gbs_api,http://bks4.books.google.com/books?id=2Q9mQgAACAAJ&printsec=frontcover&img=1&zoom=2&source=gbs_api,http://bks4.books.google.com/books?id=2Q9mQgAACAAJ&printsec=frontcover&img=1&zoom=3&source=gbs_api,http://books.google.com/books?id=2Q9mQgAACAAJ&dq=isbn:9780070579231&hl=&cd=1&source=gbs_api
