Title,Subtitle,Authors,ISBN,LCC,Publish Date,Description,Thumbnail,Small,Medium,Large,Preview
How to Break Web Software,Functional And Security Testing of Web Applications And Web Services,"Mike Andrews, James A. Whittaker",9780321369444,QA76.76.T48 W485 2006,2006,Provides information on security testing Web-based software.,http://bks3.books.google.com/books?id=mbZQAAAAMAAJ&printsec=frontcover&img=1&zoom=5&source=gbs_api,http://bks3.books.google.com/books?id=mbZQAAAAMAAJ&printsec=frontcover&img=1&zoom=1&source=gbs_api,http://bks3.books.google.com/books?id=mbZQAAAAMAAJ&printsec=frontcover&img=1&zoom=2&source=gbs_api,http://bks3.books.google.com/books?id=mbZQAAAAMAAJ&printsec=frontcover&img=1&zoom=3&source=gbs_api,http://books.google.com/books?id=mbZQAAAAMAAJ&dq=isbn:9780321369444&hl=&cd=1&source=gbs_api
68000 Family Assembly Language,"",Alan Clements,9780534932756,QA76.8.M67 C47 1994,1994,"Clements has a gift for conveying highly complex, technical information in an exceptionally clear and readable manner. Clements writing style is very student oriented, and stresses the basics of 68000 ASL while also covering the latest information on ASL later generation chips.",http://bks2.books.google.com/books?id=nLNQAAAAMAAJ&printsec=frontcover&img=1&zoom=5&source=gbs_api,http://bks2.books.google.com/books?id=nLNQAAAAMAAJ&printsec=frontcover&img=1&zoom=1&source=gbs_api,http://bks2.books.google.com/books?id=nLNQAAAAMAAJ&printsec=frontcover&img=1&zoom=2&source=gbs_api,http://bks2.books.google.com/books?id=nLNQAAAAMAAJ&printsec=frontcover&img=1&zoom=3&source=gbs_api,http://books.google.com/books?id=nLNQAAAAMAAJ&dq=isbn:9780534932756&hl=&cd=1&source=gbs_api
Smalltalk-80,The Language and Its Implementation,"Adele Goldberg, Dave Robson",9780201113716,QA76.8.S635 G64 1983,1983,Objects and messages. Expression syntax. Classes and instances. Subclasses. Metaclasses. Protocol for all objects. Linear measures. Numerical classes. Protocol for all collection classes. Hierarchy of the collection classes. Three examples that use collections. Protocol for streams. Implementations of the basic collection protocol. Kernel support. Multiple independent processes. Protocol for classes. The programming interface. Graphics Kernel. Pens. Display objects. Probability distributions. Event-driven simulations. Statistics gathering in Event-drive simulations. The use of reesources in event-drive simulations. Coordinated resources for event-drive simulations. The implementation. Specification of the virtual machine. Formal specification of the interpreter. Formal specification of the primitive methods. Formal specification of the object memory. Subject index. System index. Example class index. Implementation index.,http://bks1.books.google.com/books?id=X7dQAAAAMAAJ&printsec=frontcover&img=1&zoom=5&source=gbs_api,http://bks1.books.google.com/books?id=X7dQAAAAMAAJ&printsec=frontcover&img=1&zoom=1&source=gbs_api,http://bks1.books.google.com/books?id=X7dQAAAAMAAJ&printsec=frontcover&img=1&zoom=2&source=gbs_api,http://bks1.books.google.com/books?id=X7dQAAAAMAAJ&printsec=frontcover&img=1&zoom=3&source=gbs_api,http://books.google.com/books?id=X7dQAAAAMAAJ&dq=isbn:9780201113716&hl=&cd=1&source=gbs_api
SmallTalk-80,The Interactive Programming Environment,Adele Goldberg,9780201113723,QA76.8.S635 G638 1984,1984,"Introduction to the book and the system. Basic user interface components. How to use the text editor. How to use projects. Fundamentals of the Smalltalk-80 language. How to evaluate expressions. How to make pictures. Finding out about instances. Finding out about system classes. Finding out about messages and methods. Modifying existing class descriptions. Modifying existing class definitions. Creating a new class description. Improving performance. Examples of creating or changing browsers. Spelling correction. Syntax errors. Notification of an execution interrupt. Examining and debugging execution state. Kind of execution interrupts. Single-stepping through an execution. The file system. System backup, crash recovery, and cleanup. Appendixes. Indexes.",http://bks3.books.google.com/books?id=u7ZQAAAAMAAJ&printsec=frontcover&img=1&zoom=5&source=gbs_api,http://bks3.books.google.com/books?id=u7ZQAAAAMAAJ&printsec=frontcover&img=1&zoom=1&source=gbs_api,http://bks3.books.google.com/books?id=u7ZQAAAAMAAJ&printsec=frontcover&img=1&zoom=2&source=gbs_api,http://bks3.books.google.com/books?id=u7ZQAAAAMAAJ&printsec=frontcover&img=1&zoom=3&source=gbs_api,http://books.google.com/books?id=u7ZQAAAAMAAJ&dq=isbn:9780201113723&hl=&cd=1&source=gbs_api
Smalltalk-80,"Bits of History, Words of Advice",Glen Krasner,9780201116694,QA76.8.S635 S58 1983,1983,Focuses on Implementation of System; Provides Documentation & Covers General Software & Engineering,http://bks4.books.google.com/books?id=3rQmAAAAMAAJ&printsec=frontcover&img=1&zoom=5&source=gbs_api,http://bks4.books.google.com/books?id=3rQmAAAAMAAJ&printsec=frontcover&img=1&zoom=1&source=gbs_api,http://bks4.books.google.com/books?id=3rQmAAAAMAAJ&printsec=frontcover&img=1&zoom=2&source=gbs_api,http://bks4.books.google.com/books?id=3rQmAAAAMAAJ&printsec=frontcover&img=1&zoom=3&source=gbs_api,http://books.google.com/books?id=3rQmAAAAMAAJ&dq=isbn:9780201116694&hl=&cd=1&source=gbs_api
Introduction to computer security,"",Matthew A. Bishop,9780321247445,QA76.9.A25 B563 2005,2005,"In this authoritative book, widely respected practitioner and teacher Matt Bishop presents a clear and useful introduction to the art and science of information security. Bishop's insights and realistic examples will help any practitioner or student understand the crucial links between security theory and the day-to-day security challenges of IT environments. Bishop explains the fundamentals of security: the different types of widely used policies, the mechanisms that implement these policies, the principles underlying both policies and mechanisms, and how attackers can subvert these tools--as well as how to defend against attackers. A practicum demonstrates how to apply these ideas and mechanisms to a realistic company. Coverage includes Confidentiality, integrity, and availability Operational issues, cost-benefit and risk analyses, legal and human factors Planning and implementing effective access control Defining security, confidentiality, and integrity policies Using cryptography and public-key systems, and recognizing their limits Understanding and using authentication: from passwords to biometrics Security design principles: least-privilege, fail-safe defaults, open design, economy of mechanism, and more Controlling information flow through systems and networks Assuring security throughout the system lifecycle Malicious logic: Trojan horses, viruses, boot sector and executable infectors, rabbits, bacteria, logic bombs--and defenses against them Vulnerability analysis, penetration studies, auditing, and intrusion detection and prevention Applying security principles to networks, systems, users, and programs Introduction to Computer Securityis adapted from Bishop's comprehensive and widely praised book, Computer Security: Art and Science.This shorter version of the original work omits much mathematical formalism, making it more accessible for professionals and students who have a less formal mathematical background, or for readers with a more practical than theoretical interest.",http://bks6.books.google.com/books?id=Z-lQAAAAMAAJ&printsec=frontcover&img=1&zoom=5&source=gbs_api,http://bks6.books.google.com/books?id=Z-lQAAAAMAAJ&printsec=frontcover&img=1&zoom=1&source=gbs_api,http://bks6.books.google.com/books?id=Z-lQAAAAMAAJ&printsec=frontcover&img=1&zoom=2&source=gbs_api,http://bks6.books.google.com/books?id=Z-lQAAAAMAAJ&printsec=frontcover&img=1&zoom=3&source=gbs_api,http://books.google.com/books?id=Z-lQAAAAMAAJ&dq=isbn:9780321247445&hl=&cd=1&source=gbs_api
File system forensic analysis,"",Brian Carrier,9780321268174,QA76.9.A25 C369 2005,2005,Moves beyond the basics and shows how to use tools to recover and analyse forensic evidence.,http://bks4.books.google.com/books?id=I4gpAQAAMAAJ&printsec=frontcover&img=1&zoom=5&source=gbs_api,http://bks4.books.google.com/books?id=I4gpAQAAMAAJ&printsec=frontcover&img=1&zoom=1&source=gbs_api,http://bks4.books.google.com/books?id=I4gpAQAAMAAJ&printsec=frontcover&img=1&zoom=2&source=gbs_api,http://bks4.books.google.com/books?id=I4gpAQAAMAAJ&printsec=frontcover&img=1&zoom=3&source=gbs_api,http://books.google.com/books?id=I4gpAQAAMAAJ&dq=isbn:9780321268174&hl=&cd=1&source=gbs_api
Rootkits,Subverting the Windows Kernel,"Greg Hoglund, James Butler",9780321294319,QA76.9.A25 H637 2006,2006,"A guide to rootkits describes what they are, how they work, how to build them, and how to detect them.",http://bks2.books.google.com/books?id=fDxg1W3eT2gC&printsec=frontcover&img=1&zoom=5&edge=none&source=gbs_api,http://bks2.books.google.com/books?id=fDxg1W3eT2gC&printsec=frontcover&img=1&zoom=1&edge=none&source=gbs_api,http://bks2.books.google.com/books?id=fDxg1W3eT2gC&printsec=frontcover&img=1&zoom=2&edge=none&source=gbs_api,http://bks2.books.google.com/books?id=fDxg1W3eT2gC&printsec=frontcover&img=1&zoom=3&edge=none&source=gbs_api,http://books.google.com/books?id=fDxg1W3eT2gC&printsec=frontcover&dq=isbn:9780321294319&hl=&cd=1&source=gbs_api
Writing secure code,"","Michael Howard, David LeBlanc",9780735617223,QA76.9.A25 H698 2003,2003,"Covers topics such as the importance of secure systems, threat modeling, canonical representation issues, solving database input, denial-of-service attacks, and security code reviews and checklists.",http://bks6.books.google.com/books?id=Uafp7m2wPcMC&printsec=frontcover&img=1&zoom=5&source=gbs_api,http://bks6.books.google.com/books?id=Uafp7m2wPcMC&printsec=frontcover&img=1&zoom=1&source=gbs_api,http://bks6.books.google.com/books?id=Uafp7m2wPcMC&printsec=frontcover&img=1&zoom=2&source=gbs_api,http://bks6.books.google.com/books?id=Uafp7m2wPcMC&printsec=frontcover&img=1&zoom=3&source=gbs_api,http://books.google.com/books?id=Uafp7m2wPcMC&dq=isbn:9780735617223&hl=&cd=1&source=gbs_api
Improving Web Application Security,Threats and Countermeasures,"",9780735618428,QA76.9.A25.I46 2003,2003,"Gain a solid foundation for designing, building, and configuring security-enhanced, hack-resistant Microsoft® ASP.NET Web applications. This expert guide describes a systematic, task-based approach to security that can be applied to both new and existing applications. It addresses security considerations at the network, host, and application layers for each physical tier--Web server, remote application server, and database server--detailing the security configurations and countermeasures that can help mitigate risks. The information is organized into sections that correspond to both the product life cycle and the roles involved, making it easy for architects, designers, and developers to find the answers they need. All PATTERNS & PRACTICES guides are reviewed and approved by Microsoft engineering teams, consultants, partners, and customers--delivering accurate, real-world information that's been technically validated and tested.",http://bks1.books.google.com/books?id=Spti0mHhlsUC&printsec=frontcover&img=1&zoom=5&edge=none&source=gbs_api,http://bks1.books.google.com/books?id=Spti0mHhlsUC&printsec=frontcover&img=1&zoom=1&edge=none&source=gbs_api,http://bks1.books.google.com/books?id=Spti0mHhlsUC&printsec=frontcover&img=1&zoom=2&edge=none&source=gbs_api,http://bks1.books.google.com/books?id=Spti0mHhlsUC&printsec=frontcover&img=1&zoom=3&edge=none&source=gbs_api,http://books.google.com/books?id=Spti0mHhlsUC&printsec=frontcover&dq=isbn:9780735618428&hl=&cd=1&source=gbs_api
Protect Your Windows Network,From Perimeter to Data,"Jesper M. Johansson, Steve Riley",9780321336439,QA76.9.A25 J62 2005,2005,"A revolutionary, soups-to-nuts approach to network security from two of Microsoft's leading security experts.",http://bks8.books.google.com/books?id=yZX2uAoAagwC&printsec=frontcover&img=1&zoom=5&edge=none&source=gbs_api,http://bks8.books.google.com/books?id=yZX2uAoAagwC&printsec=frontcover&img=1&zoom=1&edge=none&source=gbs_api,http://bks8.books.google.com/books?id=yZX2uAoAagwC&printsec=frontcover&img=1&zoom=2&edge=none&source=gbs_api,http://bks8.books.google.com/books?id=yZX2uAoAagwC&printsec=frontcover&img=1&zoom=3&edge=none&source=gbs_api,http://books.google.com/books?id=yZX2uAoAagwC&printsec=frontcover&dq=isbn:9780321336439&hl=&cd=1&source=gbs_api
Software Security,Building Security in,Gary McGraw,9780321356703,QA76.9.A25 M4286 2006,2006,"Describes how to put software security into practice, covering such topics as risk management frameworks, architectural risk analysis, security testing, and penetration testing.",http://bks8.books.google.com/books?id=HCQdypbpZXgC&printsec=frontcover&img=1&zoom=5&edge=none&source=gbs_api,http://bks8.books.google.com/books?id=HCQdypbpZXgC&printsec=frontcover&img=1&zoom=1&edge=none&source=gbs_api,http://bks8.books.google.com/books?id=HCQdypbpZXgC&printsec=frontcover&img=1&zoom=2&edge=none&source=gbs_api,http://bks8.books.google.com/books?id=HCQdypbpZXgC&printsec=frontcover&img=1&zoom=3&edge=none&source=gbs_api,http://books.google.com/books?id=HCQdypbpZXgC&printsec=frontcover&dq=isbn:9780321356703&hl=&cd=1&source=gbs_api
Security for Microsoft Visual Basic .NET,"","Ed Robinson, Michael Bond",9780735619197,QA76.9.A25 R635 2003,2003-05-08,"This resource is an end-to-end guide, with clear prescriptive guidance for best practices, application design, and coding techniques for Windows and Web-based applications. It makes writing secure applications easier than ever before. (Computer Books)",http://bks1.books.google.com/books?id=xNZQAAAAMAAJ&printsec=frontcover&img=1&zoom=5&source=gbs_api,http://bks1.books.google.com/books?id=xNZQAAAAMAAJ&printsec=frontcover&img=1&zoom=1&source=gbs_api,http://bks1.books.google.com/books?id=xNZQAAAAMAAJ&printsec=frontcover&img=1&zoom=2&source=gbs_api,http://bks1.books.google.com/books?id=xNZQAAAAMAAJ&printsec=frontcover&img=1&zoom=3&source=gbs_api,http://books.google.com/books?id=xNZQAAAAMAAJ&dq=isbn:9780735619197&hl=&cd=1&source=gbs_api
Secure coding in C and C++,"",Robert C. Seacord,9780321335722,QA76.9.A25 S368 2006,2006,A code companion developers will turn to again and again as they seek to protect their systems from attackers.,http://bks9.books.google.com/books?id=1dlQAAAAMAAJ&printsec=frontcover&img=1&zoom=5&source=gbs_api,http://bks9.books.google.com/books?id=1dlQAAAAMAAJ&printsec=frontcover&img=1&zoom=1&source=gbs_api,http://bks9.books.google.com/books?id=1dlQAAAAMAAJ&printsec=frontcover&img=1&zoom=2&source=gbs_api,http://bks9.books.google.com/books?id=1dlQAAAAMAAJ&printsec=frontcover&img=1&zoom=3&source=gbs_api,http://books.google.com/books?id=1dlQAAAAMAAJ&dq=isbn:9780321335722&hl=&cd=1&source=gbs_api
Malware,Fighting Malicious Code,Ed Skoudis,9780131014053,QA76.9.A25 S58 2004,2004,"Describes various types of malware, including viruses, worms, user-level RootKits, and kernel-level manipulation, their haracteristics and attack method, and how to defend against an attack.",http://bks8.books.google.com/books?id=TKEAQmQV7O4C&printsec=frontcover&img=1&zoom=5&edge=none&source=gbs_api,http://bks8.books.google.com/books?id=TKEAQmQV7O4C&printsec=frontcover&img=1&zoom=1&edge=none&source=gbs_api,http://bks8.books.google.com/books?id=TKEAQmQV7O4C&printsec=frontcover&img=1&zoom=2&edge=none&source=gbs_api,http://bks8.books.google.com/books?id=TKEAQmQV7O4C&printsec=frontcover&img=1&zoom=3&edge=none&source=gbs_api,http://books.google.com/books?id=TKEAQmQV7O4C&printsec=frontcover&dq=isbn:9780131014053&hl=&cd=1&source=gbs_api
IT architectures and middleware,"strategies for building large, integrated systems",Chris Britton,9780201709070,QA76.9.A73 B77 2001,2001,"Every year, large organizations find their IT systems becoming more complex, and more diverse -- and the need for effective enterprise integration becomes more urgent. In this book, Chris Britton offers IT architects and decision-makers practical start-to-finish guidance for defining architectures and choosing middleware strategies that integrate the entire enterprise, maximizing flexibility, resiliency, scalability, security, and manageability. IT Architectures and Middleware gives IT professionals expert guidance for identifying key architectural issues, and building complex distributed systems with confidence and foresight. Rather than focusing on a specific technology such as COM, CORBA, or Enterprise Java Beans, Chris Britton starts with the realities of IT in the enterprise: its massive size and accelerating growth rates. Britton helps system architects rise above the hype and evade the vendor crossfire, presenting a quick survey of middleware technology, and offering guidance on the IT structures and middleware technologies most likely to address their business requirements. For all system architects, project managers, IT leaders and strategists.",http://bks8.books.google.com/books?id=uNlQAAAAMAAJ&printsec=frontcover&img=1&zoom=5&source=gbs_api,http://bks8.books.google.com/books?id=uNlQAAAAMAAJ&printsec=frontcover&img=1&zoom=1&source=gbs_api,http://bks8.books.google.com/books?id=uNlQAAAAMAAJ&printsec=frontcover&img=1&zoom=2&source=gbs_api,http://bks8.books.google.com/books?id=uNlQAAAAMAAJ&printsec=frontcover&img=1&zoom=3&source=gbs_api,http://books.google.com/books?id=uNlQAAAAMAAJ&dq=isbn:9780201709070&hl=&cd=1&source=gbs_api
Distributed Object Architectures with CORBA,"",Henry Balen,9780521654180,QA76.9.A73 D57 2000,2000-02-13,"This book is a guide to creating a software architecture comprised of distributed components. While it is based on OMG's CORBA standard, the principles also apply to architecture built with other technology, such as Microsoft's DCOM.",http://bks7.books.google.com/books?id=M0aIf-3g_sgC&printsec=frontcover&img=1&zoom=5&edge=none&source=gbs_api,http://bks7.books.google.com/books?id=M0aIf-3g_sgC&printsec=frontcover&img=1&zoom=1&edge=none&source=gbs_api,http://bks7.books.google.com/books?id=M0aIf-3g_sgC&printsec=frontcover&img=1&zoom=2&edge=none&source=gbs_api,http://bks7.books.google.com/books?id=M0aIf-3g_sgC&printsec=frontcover&img=1&zoom=3&edge=none&source=gbs_api,http://books.google.com/books?id=M0aIf-3g_sgC&printsec=frontcover&dq=isbn:9780521654180&hl=&cd=1&source=gbs_api
Documenting Software Architectures,Views and Beyond,Paul Clements,9780201703726,QA76.9.A73 D63 2003,2003,"The definitive practitioner's guide to capturing and documenting software architecture. -- Documenting architecture so designers and implementers can use it as a framework for effective development. -- Shows how to document the key information associated with each architectural view -- and package that information in coherent, usable form. -- Works with any language, notation system, or view-based model of software architecture. Architecture is crucial to the success of any large software system -- but even a superb architecture will fail if it isn't communicated well. Now, there's a language- and notation-independent guide to capturing architecture so it can be used successfully by every analyst, software designer, and developer. The authors review the diverse goals and uses of software architecture documentation, providing documentation strategies for several common scenarios. They identify the basic unit of software architecture documentation: the viewtype, which specifies the type of information to be provided in an architectural view. For each viewtype -- Modules, Component-and-Connectors, and Allocation -- they offer detailed guidance on documenting what really matters. Next, they demonstrate how to package architecture documentation in coherent, usable form: augmenting architectural views with documentation of interfaces and behavior; accounting for architectural variability and dynamic systems; and more.",http://bks3.books.google.com/books?id=ASc9HYPkr4sC&printsec=frontcover&img=1&zoom=5&edge=none&source=gbs_api,http://bks3.books.google.com/books?id=ASc9HYPkr4sC&printsec=frontcover&img=1&zoom=1&edge=none&source=gbs_api,http://bks3.books.google.com/books?id=ASc9HYPkr4sC&printsec=frontcover&img=1&zoom=2&edge=none&source=gbs_api,http://bks3.books.google.com/books?id=ASc9HYPkr4sC&printsec=frontcover&img=1&zoom=3&edge=none&source=gbs_api,http://books.google.com/books?id=ASc9HYPkr4sC&printsec=frontcover&dq=isbn:9780201703726&hl=&cd=1&source=gbs_api
Architecting with RM-ODP,"",Janis Putman,9780130191168,QA76.9.A73 P87 2001,2001,"This is the first complete guide to explain RM-0DP's innovations, will show exactly how to use them to archive practical benefits. The breakthrough international standard for software architecture.",http://bks2.books.google.com/books?id=PA7BewHWqJQC&printsec=frontcover&img=1&zoom=5&edge=none&source=gbs_api,http://bks2.books.google.com/books?id=PA7BewHWqJQC&printsec=frontcover&img=1&zoom=1&edge=none&source=gbs_api,http://bks2.books.google.com/books?id=PA7BewHWqJQC&printsec=frontcover&img=1&zoom=2&edge=none&source=gbs_api,http://bks2.books.google.com/books?id=PA7BewHWqJQC&printsec=frontcover&img=1&zoom=3&edge=none&source=gbs_api,http://books.google.com/books?id=PA7BewHWqJQC&printsec=frontcover&dq=isbn:9780130191168&hl=&cd=1&source=gbs_api
Synthesis-based Software Architecture Design,"","Bedir Tekinerdoğan, University of Twente. Department of Computer Science",9789036514309,QA76.9.A73.T45 2000,2000,,,,,,http://books.google.com/books?id=lWLDAAAACAAJ&dq=isbn:9789036514309&hl=&cd=1&source=gbs_api
Computer Organization and the Mc68000,"","Panos E. Livadas, Christopher Ward",9780131589407,QA76.9.C643 L58 1993,1993,Uses the MC68000 microprocessor as a model to introduce the principles of computer organization and assembly language programming,http://bks8.books.google.com/books?id=0pEkAQAAIAAJ&printsec=frontcover&img=1&zoom=5&source=gbs_api,http://bks8.books.google.com/books?id=0pEkAQAAIAAJ&printsec=frontcover&img=1&zoom=1&source=gbs_api,http://bks8.books.google.com/books?id=0pEkAQAAIAAJ&printsec=frontcover&img=1&zoom=2&source=gbs_api,http://bks8.books.google.com/books?id=0pEkAQAAIAAJ&printsec=frontcover&img=1&zoom=3&source=gbs_api,http://books.google.com/books?id=0pEkAQAAIAAJ&dq=isbn:9780131589407&hl=&cd=1&source=gbs_api
A Gift of Fire,"Social, Legal, and Ethical Issues in Computing",Sara Baase,9780134587790,QA76.9.C66 B3 1997,1997,"[This book] provides in-depth coverage of the challenge and implications of computer technology, including important issues such as the impact of computers on privacy, censorship of the Internet, government policy on encryption, protection of intellectual property in cyberspace, hacking and computer crime, risks from failures of computer systems, and ethical dilemmas faced by computer professionals and computer users.--Back cover.",http://bks8.books.google.com/books?id=r5gfAQAAIAAJ&printsec=frontcover&img=1&zoom=5&source=gbs_api,http://bks8.books.google.com/books?id=r5gfAQAAIAAJ&printsec=frontcover&img=1&zoom=1&source=gbs_api,http://bks8.books.google.com/books?id=r5gfAQAAIAAJ&printsec=frontcover&img=1&zoom=2&source=gbs_api,http://bks8.books.google.com/books?id=r5gfAQAAIAAJ&printsec=frontcover&img=1&zoom=3&source=gbs_api,http://books.google.com/books?id=r5gfAQAAIAAJ&dq=isbn:9780134587790&hl=&cd=1&source=gbs_api
Computers and Society,The Technology and Its Social Implications [with] Instructor's Guide,"Stanley Rothman, Charles John Mosmann",9780574210555,QA76.9.C66 R67 1976,1976-01-01,,http://bks2.books.google.com/books?id=pNwmAAAAMAAJ&printsec=frontcover&img=1&zoom=5&source=gbs_api,http://bks2.books.google.com/books?id=pNwmAAAAMAAJ&printsec=frontcover&img=1&zoom=1&source=gbs_api,http://bks2.books.google.com/books?id=pNwmAAAAMAAJ&printsec=frontcover&img=1&zoom=2&source=gbs_api,http://bks2.books.google.com/books?id=pNwmAAAAMAAJ&printsec=frontcover&img=1&zoom=3&source=gbs_api,http://books.google.com/books?id=pNwmAAAAMAAJ&dq=isbn:9780574210555&hl=&cd=1&source=gbs_api
Introduction to Statistical Relational Learning,"","Lise Getoor, Ben Taskar",9780262072885,QA76.9.D3 I68 2007,2007,"Advanced statistical modeling and knowledge representation techniques for a newly emerging area of machine learning and probabilistic reasoning; includes introductory material, tutorials for different proposed approaches, and applications.",http://bks7.books.google.com/books?id=lSkIewOw2WoC&printsec=frontcover&img=1&zoom=5&edge=none&source=gbs_api,http://bks7.books.google.com/books?id=lSkIewOw2WoC&printsec=frontcover&img=1&zoom=1&edge=none&source=gbs_api,http://bks7.books.google.com/books?id=lSkIewOw2WoC&printsec=frontcover&img=1&zoom=2&edge=none&source=gbs_api,http://bks7.books.google.com/books?id=lSkIewOw2WoC&printsec=frontcover&img=1&zoom=3&edge=none&source=gbs_api,http://books.google.com/books?id=lSkIewOw2WoC&printsec=frontcover&dq=isbn:9780262072885&hl=&cd=1&source=gbs_api
Object Success,"A Manager's Guide to Object Orientation, Its Impact on the Corporation, and Its Use for Reengineering the Software Process",Bertrand Meyer,9780131928336,QA76.9.D3 M494 1995,1995,"Object frenzy; The ten key O-O concepts; The object-oriented lifecycle; But what about prototyping; Managing the transation; Nature and nurture: making reuse succed; The manager's role, 1: fundamentals; The manager's role, 2: technical manager.",http://bks0.books.google.com/books?id=lrFgQgAACAAJ&printsec=frontcover&img=1&zoom=5&source=gbs_api,http://bks0.books.google.com/books?id=lrFgQgAACAAJ&printsec=frontcover&img=1&zoom=1&source=gbs_api,http://bks0.books.google.com/books?id=lrFgQgAACAAJ&printsec=frontcover&img=1&zoom=2&source=gbs_api,http://bks0.books.google.com/books?id=lrFgQgAACAAJ&printsec=frontcover&img=1&zoom=3&source=gbs_api,http://books.google.com/books?id=lrFgQgAACAAJ&dq=isbn:9780131928336&hl=&cd=1&source=gbs_api
