Title,Subtitle,Authors,ISBN,LCC,Publish Date,Description,Thumbnail,Small,Medium,Large,Preview
Invasive Software Composition,"",Uwe Aßmann,9783540443858,QA76.76.C66 A26 2003,2003-02-27,"Invasive software composition as a new, component-based way to construct software systems is presented. To improve reuse, this method regards software components as greybox and integrates them during composition. Components are distinct in design, but are merged in implementations, leading to highly integrated and more efficient systems. Building on a minimal set of program transformations, composition operator libraries can be developed that parameterize, extend, connect, mediate, and aspect-weave components. Invasive software composition unifies several software engineering techniques such as generic programming, architecture systems, inheritance, and aspect-oriented programming. The book is centered around the JAVA language and a freely available demonstrator library called COMPOST. The book provides a wealth of material for researchers, students and professional software architects alike.",http://bks4.books.google.com/books?id=XL9HzevBcawC&printsec=frontcover&img=1&zoom=5&edge=none&source=gbs_api,http://bks4.books.google.com/books?id=XL9HzevBcawC&printsec=frontcover&img=1&zoom=1&edge=none&source=gbs_api,http://bks4.books.google.com/books?id=XL9HzevBcawC&printsec=frontcover&img=1&zoom=2&edge=none&source=gbs_api,http://bks4.books.google.com/books?id=XL9HzevBcawC&printsec=frontcover&img=1&zoom=3&edge=none&source=gbs_api,http://books.google.com/books?id=XL9HzevBcawC&printsec=frontcover&dq=isbn:9783540443858&hl=&cd=1&source=gbs_api
An Introduction to Compiler Construction,,"William M. Waite, Lynn R. Carter",9780673398222,QA76.76.C65 W35 1992,1992,,,,,,
"Compilers, principles, techniques, and tools","","Alfred V. Aho, Ravi Sethi, Jeffrey D. Ullman",9780201100884,QA76.76.C65 A37 1986,1986,"This book provides the foundation for understanding the theory and pracitce of compilers. Revised and updated, it reflects the current state of compilation. Every chapter has been completely revised to reflect developments in software engineering, programming languages, and computer architecture that have occurred since 1986, when the last edition published.& The authors, recognizing that few readers will ever go on to construct a compiler, retain their focus on the broader set of problems faced in software design and software development. Computer scientists, developers, & and aspiring students that want to learn how to build, maintain, and execute a compiler for a major programming language.",http://bks8.books.google.com/books?id=-4Q_AQAAIAAJ&printsec=frontcover&img=1&zoom=5&source=gbs_api,http://bks8.books.google.com/books?id=-4Q_AQAAIAAJ&printsec=frontcover&img=1&zoom=1&source=gbs_api,http://bks8.books.google.com/books?id=-4Q_AQAAIAAJ&printsec=frontcover&img=1&zoom=2&source=gbs_api,http://bks8.books.google.com/books?id=-4Q_AQAAIAAJ&printsec=frontcover&img=1&zoom=3&source=gbs_api,http://books.google.com/books?id=-4Q_AQAAIAAJ&dq=isbn:9780201100884&hl=&cd=1&source=gbs_api
Enterprise Modeling with UML,Designing Successful Software Through Business Analysis,Chris Marshall,9780201433135,QA76.76.A65 M345 2000,2000,"Provides a software system design methodology that allows designers to build Object-based applications within a large company. The focus is on the specific needs of the large-scale organization. All modelling techniques are proposed in UML, and all code is written in either Java or XML.",http://bks2.books.google.com/books?id=cvcF9mB3PekC&printsec=frontcover&img=1&zoom=5&edge=none&source=gbs_api,http://bks2.books.google.com/books?id=cvcF9mB3PekC&printsec=frontcover&img=1&zoom=1&edge=none&source=gbs_api,http://bks2.books.google.com/books?id=cvcF9mB3PekC&printsec=frontcover&img=1&zoom=2&edge=none&source=gbs_api,http://bks2.books.google.com/books?id=cvcF9mB3PekC&printsec=frontcover&img=1&zoom=3&edge=none&source=gbs_api,http://books.google.com/books?id=cvcF9mB3PekC&printsec=frontcover&dq=isbn:9780201433135&hl=&cd=1&source=gbs_api
UML Xtra-Light,How to Specify Your Software Requirements,Milan Kratochvil,9780521892421,QA76.76.A65 K72 2003,2003,"If you are a non-technical person with a stake in the success of a software project, this book is for you. Business managers often find it impossible to communicate business objectives and specify their software requirements to technical members of staff. This beginner's guide teaches readers to communicate with software developers in a more focused, effective way. It describes the basic diagrams of the UML modeling notation and shows how they are used to specify requirements in a unambiguous way. When used on project, the risk of failure through unclear requirements is removed.",http://bks7.books.google.com/books?id=gQNGM1ytCDAC&printsec=frontcover&img=1&zoom=5&edge=none&source=gbs_api,http://bks7.books.google.com/books?id=gQNGM1ytCDAC&printsec=frontcover&img=1&zoom=1&edge=none&source=gbs_api,http://bks7.books.google.com/books?id=gQNGM1ytCDAC&printsec=frontcover&img=1&zoom=2&edge=none&source=gbs_api,http://bks7.books.google.com/books?id=gQNGM1ytCDAC&printsec=frontcover&img=1&zoom=3&edge=none&source=gbs_api,http://books.google.com/books?id=gQNGM1ytCDAC&printsec=frontcover&dq=isbn:9780521892421&hl=&cd=1&source=gbs_api
Software architecture for product families,principles and practice,"Mehdi Jazayeri, A. C. M. Ran, Frank van der Linden",9780201699678,QA76.76.A65 J65 2000,2000,"Software development organizations are now discovering the efficiencies that can be achieved by architecting entire software product families together. In Software Architecture for Product Families, experts from one of the world's most advanced software domain engineering projects share in-depth insights about the techniques that work -- and those that don't. The book offers a solutions-oriented, case-study approach covering the entire development lifecycle, based on advanced work done by three of Europe's leading technology companies and their academic partners. Discover the challenges that drive companies to consider architecting product families, and the new problems they encounter in doing so. Master concepts and terms that can be used to describe the architecture of a product family; then learn how to assess that architecture, and transform it into working applications. The authors also present chapter-length, real-world case studies of domain engineering projects at Nokia, Philips, and ABB.",http://bks9.books.google.com/books?id=CKlQAAAAMAAJ&printsec=frontcover&img=1&zoom=5&source=gbs_api,http://bks9.books.google.com/books?id=CKlQAAAAMAAJ&printsec=frontcover&img=1&zoom=1&source=gbs_api,http://bks9.books.google.com/books?id=CKlQAAAAMAAJ&printsec=frontcover&img=1&zoom=2&source=gbs_api,http://bks9.books.google.com/books?id=CKlQAAAAMAAJ&printsec=frontcover&img=1&zoom=3&source=gbs_api,http://books.google.com/books?id=CKlQAAAAMAAJ&dq=isbn:9780201699678&hl=&cd=1&source=gbs_api
Applied Software Architecture,"","Christine Hofmeister, Robert Nord, Dilip Soni",9780201325713,QA76.76.A65.H654 1999,2000,"'Applied Software Architecture' provides practical guidelines and techniques for producing quality software designs. It gives an overview of software architecture basics and a detailed guide to architecture design tasks, focusing on four fundamental views",http://bks8.books.google.com/books?id=3klAPCIB3hQC&printsec=frontcover&img=1&zoom=5&edge=none&source=gbs_api,http://bks8.books.google.com/books?id=3klAPCIB3hQC&printsec=frontcover&img=1&zoom=1&edge=none&source=gbs_api,http://bks8.books.google.com/books?id=3klAPCIB3hQC&printsec=frontcover&img=1&zoom=2&edge=none&source=gbs_api,http://bks8.books.google.com/books?id=3klAPCIB3hQC&printsec=frontcover&img=1&zoom=3&edge=none&source=gbs_api,http://books.google.com/books?id=3klAPCIB3hQC&printsec=frontcover&dq=isbn:9780201325713&hl=&cd=1&source=gbs_api
Working Effectively with Legacy Code,"",Michael C. Feathers,9780131177055,QA76.76.A65 F43 2005,2004,"In this book, Michael Feathers offers start-to-finish strategies for working more effectively with large, untested legacy code bases. This book draws on material Michael created for his own renowned Object Mentor seminars: techniques Michael has used in mentoring to help hundreds of developers, technical managers, and testers bring their legacy systems under control. This book also includes a catalog of twenty-four dependency-breaking techniques that help you work with program elements in isolation and make safer changes.",http://bks9.books.google.com/books?id=vlo_nWophSYC&printsec=frontcover&img=1&zoom=5&source=gbs_api,http://bks9.books.google.com/books?id=vlo_nWophSYC&printsec=frontcover&img=1&zoom=1&source=gbs_api,http://bks9.books.google.com/books?id=vlo_nWophSYC&printsec=frontcover&img=1&zoom=2&source=gbs_api,http://bks9.books.google.com/books?id=vlo_nWophSYC&printsec=frontcover&img=1&zoom=3&source=gbs_api,http://books.google.com/books?id=vlo_nWophSYC&dq=isbn:9780131177055&hl=&cd=1&source=gbs_api
Software for Use,A Practical Guide to the Models and Methods of Usage-Centered Design,"Larry L. Constantine, Lucy A. D. Lockwood",9780201924787,QA76.76.A65 C665 1999,1999,"In the quest for quality, software developers have long focused on improving the internal architecture of their products. Larry L. Constantine--who originally created structured design to effect such improvement--now joins with well-known consultant Lucy A. D. Lockwood to turn the focus of software development to the external architecture. In this book, they present the models and methods of a revolutionary approach to software that will help programmers deliver more usable software--software that will enable users to accomplish their tasks with greater ease and efficiency. Recognizing usability as the key to successful software, Constantine and Lockwood provide concrete tools and techniques that programmers can employ to meet that end. Much more than just another set of rules for good user-interface design, this book guides readers through a systematic software development process. This process, called usage-centered design, weaves together two major threads in software development methods: use cases (also used with UML) and essential modeling. With numerous examples and case studies of both conventional and specialized software applications, the authors illustrate what has been shown in practice to work and what has proved to be of greatest practical value. Highlights Presents a streamlined process for developing highly usable software Describes practical methods and models successfully implemented in industry Complements modern development practices, including the Unified Process and other object-oriented software engineering approaches",http://bks7.books.google.com/books?id=WKRQAAAAMAAJ&printsec=frontcover&img=1&zoom=5&source=gbs_api,http://bks7.books.google.com/books?id=WKRQAAAAMAAJ&printsec=frontcover&img=1&zoom=1&source=gbs_api,http://bks7.books.google.com/books?id=WKRQAAAAMAAJ&printsec=frontcover&img=1&zoom=2&source=gbs_api,http://bks7.books.google.com/books?id=WKRQAAAAMAAJ&printsec=frontcover&img=1&zoom=3&source=gbs_api,http://books.google.com/books?id=WKRQAAAAMAAJ&dq=isbn:9780201924787&hl=&cd=1&source=gbs_api
Integration-Ready Architecture and Design,"Software Engineering with XML, Java, .NET, Wireless, Speech, and Knowledge Technologies",Jeff Zhuk,9780521525831,QA76.758 Z48 2004,2004-07-26,"What would you do if your IT job was no longer performed in your country? Your survival does not lie in limiting global collaborative engineering. IT workers will survive and prosper because of their ability to innovate, to quickly learn and change directions, and to evolve from Information Technology into Distributed Knowledge Marketplace. You have no choice but to be pro-active, learn to stay current, even run ahead of the game. Integration-Ready Architecture and Design bridges the gap for a new generation of wired and wireless software technologies and teaches a set of skills that are demanded by fast moving software evolution. This up-to-date textbook integrates theory and practice, going from foundations and concepts to specific applications. Through deep insights into almost all areas of modern CIS and IT, Zhuk provides an entry into the new world of integrated knowledge and software engineering. Readers will learn the what s, why s, and how s on: J2EE, J2ME, .NET, JSAPI, JMS, JMF, SALT, VoiceXML, WAP, 802.11, CDNA, GPRS, CycL, XML, and multiple XML-based technologies including RDF, DAML, SOAP, UDDI, and WDSL. Students, architects, designers, coders, and even management benefit from innovative ideas and detailed examples for building multi-dimensional worlds of enterprise applications and creating distributed knowledge marketplace.",http://bks8.books.google.com/books?id=AP3SgaDQjkYC&printsec=frontcover&img=1&zoom=5&edge=none&source=gbs_api,http://bks8.books.google.com/books?id=AP3SgaDQjkYC&printsec=frontcover&img=1&zoom=1&edge=none&source=gbs_api,http://bks8.books.google.com/books?id=AP3SgaDQjkYC&printsec=frontcover&img=1&zoom=2&edge=none&source=gbs_api,http://bks8.books.google.com/books?id=AP3SgaDQjkYC&printsec=frontcover&img=1&zoom=3&edge=none&source=gbs_api,http://books.google.com/books?id=AP3SgaDQjkYC&printsec=frontcover&dq=isbn:9780521525831&hl=&cd=1&source=gbs_api
Software architecture and design,"principles, models, and methods","Bernard I. Witt, F. Terry Baker, Everett W. Merritt",9780442015565,QA76.758 W57 1994,1994-05,"This advanced guide for software engineers is intended to provide useful building blocks for the design of highly complex software. The authors have devised a small, integrated set of software design principles, along with practical models of the principles at work. Includes solutions for simultaneous execution in different configurations and operating systems.",http://bks5.books.google.com/books?id=zXIhAQAAIAAJ&printsec=frontcover&img=1&zoom=5&source=gbs_api,http://bks5.books.google.com/books?id=zXIhAQAAIAAJ&printsec=frontcover&img=1&zoom=1&source=gbs_api,http://bks5.books.google.com/books?id=zXIhAQAAIAAJ&printsec=frontcover&img=1&zoom=2&source=gbs_api,http://bks5.books.google.com/books?id=zXIhAQAAIAAJ&printsec=frontcover&img=1&zoom=3&source=gbs_api,http://books.google.com/books?id=zXIhAQAAIAAJ&dq=isbn:9780442015565&hl=&cd=1&source=gbs_api
Estimating software-intensive systems,"projects, products, and processes",Richard D. Stutzke,9780201703122,QA76.758 S79 2005,2005,"This book outlines practical, proven estimating techniques that are simple and easy to use for software practitioners.",http://bks3.books.google.com/books?id=arhQAAAAMAAJ&printsec=frontcover&img=1&zoom=5&source=gbs_api,http://bks3.books.google.com/books?id=arhQAAAAMAAJ&printsec=frontcover&img=1&zoom=1&source=gbs_api,http://bks3.books.google.com/books?id=arhQAAAAMAAJ&printsec=frontcover&img=1&zoom=2&source=gbs_api,http://bks3.books.google.com/books?id=arhQAAAAMAAJ&printsec=frontcover&img=1&zoom=3&source=gbs_api,http://books.google.com/books?id=arhQAAAAMAAJ&dq=isbn:9780201703122&hl=&cd=1&source=gbs_api
Project-based software engineering,an object-oriented approach,"Evelyn Stiller, Cathie LeBlanc",9780201742251,QA76.758 S75 2002,2002,"Project-Based Software Engineeringis the first book to provide hands-on process and practice in software engineering essentials for the beginner. The book presents steps through the software development life cycle and two running case studies that develop as the steps are presented. Running parallel to the process presentation and case studies, the book supports a semester-long software development project.This book focuses on object-oriented software development, and supports the conceptualization, analysis, design and implementation of an object-oriented project. It is mostly language-independent, with necessary code examples in Java. A subset of UML is used, with the notation explained as needed to support the readers' work. Two running case studies a video game and a library check out system show the development of a software project. Both have sample deliverables and thus provide the reader with examples of the type of work readers are to create.This book is appropriate for readers looking to gain experience in project analysis, design implementation, and testing.",http://bks0.books.google.com/books?id=fXAhAQAAIAAJ&printsec=frontcover&img=1&zoom=5&source=gbs_api,http://bks0.books.google.com/books?id=fXAhAQAAIAAJ&printsec=frontcover&img=1&zoom=1&source=gbs_api,http://bks0.books.google.com/books?id=fXAhAQAAIAAJ&printsec=frontcover&img=1&zoom=2&source=gbs_api,http://bks0.books.google.com/books?id=fXAhAQAAIAAJ&printsec=frontcover&img=1&zoom=3&source=gbs_api,http://books.google.com/books?id=fXAhAQAAIAAJ&dq=isbn:9780201742251&hl=&cd=1&source=gbs_api
Using UML,Software Engineering with Objects and Components,"Perdita Stevens, Rob Pooley",9780201648607,QA76.758 S74 2000,2000,,,,,,
Applied Software Project Management,"","Andrew Stellman, Jennifer Greene",9780596009489,QA76.758 S735 2006,2006,Provides information on planning and managing a software project.,http://bks0.books.google.com/books?id=60ozmAEACAAJ&printsec=frontcover&img=1&zoom=5&source=gbs_api,http://bks0.books.google.com/books?id=60ozmAEACAAJ&printsec=frontcover&img=1&zoom=1&source=gbs_api,http://bks0.books.google.com/books?id=60ozmAEACAAJ&printsec=frontcover&img=1&zoom=2&source=gbs_api,http://bks0.books.google.com/books?id=60ozmAEACAAJ&printsec=frontcover&img=1&zoom=3&source=gbs_api,http://books.google.com/books?id=60ozmAEACAAJ&dq=isbn:9780596009489&hl=&cd=1&source=gbs_api
Software Engineering [With Access Code],"",Ian Sommerville,9780137035151,QA76.758 S657 2011,2010-02-19,"This book discusses a comprehensive spectrum of software engineering techniques and shows how they can be applied in practical software projects. This edition features updated chapters on critical systems, project management and software requirements.",http://bks6.books.google.com/books?id=mBb8QQAACAAJ&printsec=frontcover&img=1&zoom=5&source=gbs_api,http://bks6.books.google.com/books?id=mBb8QQAACAAJ&printsec=frontcover&img=1&zoom=1&source=gbs_api,http://bks6.books.google.com/books?id=mBb8QQAACAAJ&printsec=frontcover&img=1&zoom=2&source=gbs_api,http://bks6.books.google.com/books?id=mBb8QQAACAAJ&printsec=frontcover&img=1&zoom=3&source=gbs_api,http://books.google.com/books?id=mBb8QQAACAAJ&dq=isbn:9780137035151&hl=&cd=1&source=gbs_api
Software Engineering,"",Ian Sommerville,9780321313799,QA76.758 S657 2007,2007,"SOMMERVILLE Software Engineering 8 The eighth edition of the best-selling introduction to software engineering is now updated with three new chapters on state-of-the-art topics. New chapters in the 8th edition O Security engineering, showing youhow you can design software to resist attacks and recover from damage; O Service-oriented software engineering, explaininghow reusable web services can be used to develop new applications; O Aspect-oriented software development, introducing new techniques based on the separation of concerns. Key features O Includes the latest developments in software engineering theory and practice, integrated with relevant aspects of systems engineering. O Extensive coverage ofagile methods andreuse. O Integrated coverage of system safety, security and reliability - illustrating best practice in developing critical systems. O Two running case studies (an information system and a control system) illuminate different stages of thesoftware lifecycle. Online resources Visit www.pearsoned.co.uk/sommerville to access a full range of resources for students and instructors. In addition, a rich collection of resources including links to other web sites, teaching material on related courses and additional chapters is available at http: //www.software-engin.com. IAN SOMMERVILLE is Professor of Software Engineering at the University of St. Andrews in Scotland.",http://bks5.books.google.com/books?id=GaRbZtWShxkC&printsec=frontcover&img=1&zoom=5&source=gbs_api,http://bks5.books.google.com/books?id=GaRbZtWShxkC&printsec=frontcover&img=1&zoom=1&source=gbs_api,http://bks5.books.google.com/books?id=GaRbZtWShxkC&printsec=frontcover&img=1&zoom=2&source=gbs_api,http://bks5.books.google.com/books?id=GaRbZtWShxkC&printsec=frontcover&img=1&zoom=3&source=gbs_api,http://books.google.com/books?id=GaRbZtWShxkC&dq=isbn:9780321313799&hl=&cd=1&source=gbs_api
Software engineering,"",Ian Sommerville,9780201398151,QA76.758 S657 2000,2001,"Software Engineering presents a broad perspective on software systems engineering, concentrating on widely-used techniques for developing large-scale software systems. In seven parts, this best-selling book covers a wide spectrum of software processes from initial requirements elicitation through design and development to system evolution. It supports students taking undergraduate and graduate courses in software engineering and software engineers in industry who need to update their knowledge on new techniques such as requirements engineering, distributed systems architectures and system dependability. Extensive market research has ensured that this new edition is useful and relevant for both students and practising software engineers. The sixth edition has been restructured and updated, important new topics have been added and obsolete material has been cut. The end result is an even more focused book that is about 10% shorter than the previous edition. Changes from the fifth edition - There are new chapters covering software processes, distributed systems architectures, dependability and legacy systems. - Program examples are now in Java and graphical system models are described in the standard UML. - All chapters have been updated and several have been extensively rewritten. Reuse now focuses on component-based development and patterns; object-oriented design has a process focus and uses the UML; the chapters on requirements have been split to cover the requirements themselves and requirements engineering process; cost estimation has been updated to include the COCOMO 2 model. - The chapters on critical systems has been restructured so that reliability, safety, availability and security are integrated in chapters on critical systems specification, development and validation. - The section on formal specification has been cut to a single chapter and material on CASE has been integrated with the chapters covering the processes supported. Functional design has been incorporated in the new chapter on legacy systems. The book's web site (www.software-engin.com) includes links to material to support the use of the book in teaching and personal study. It includes an instructor's manual, overhead transparencies, source code of the program examples and additional material on CASE and formal specification. Ian Sommerville is Professor of Software Engineering at Lancaster University, England. He has more than 20 years of experience in software engineering education and research. His current areas of interest include computer-based systems engineering, requirements engineering, system dependability and software evolution.",http://bks5.books.google.com/books?id=Uoo_AQAAIAAJ&printsec=frontcover&img=1&zoom=5&source=gbs_api,http://bks5.books.google.com/books?id=Uoo_AQAAIAAJ&printsec=frontcover&img=1&zoom=1&source=gbs_api,http://bks5.books.google.com/books?id=Uoo_AQAAIAAJ&printsec=frontcover&img=1&zoom=2&source=gbs_api,http://bks5.books.google.com/books?id=Uoo_AQAAIAAJ&printsec=frontcover&img=1&zoom=3&source=gbs_api,http://books.google.com/books?id=Uoo_AQAAIAAJ&dq=isbn:9780201398151&hl=&cd=1&source=gbs_api
The Role of Platelet-activating Factor in Immune Disorders,"Proceedings of the Meeting of the Fondation IPSEN Pour la Recherche Thérapeutique, Paris, June 25-26, 1987","Fondation IPSEN pour la Recherche Thérapeutique. Meeting (, P. Braquet",9780201427653,QA76.758 S657 1996,1988,,http://bks4.books.google.com/books?id=UhExPwAACAAJ&printsec=frontcover&img=1&zoom=5&source=gbs_api,http://bks4.books.google.com/books?id=UhExPwAACAAJ&printsec=frontcover&img=1&zoom=1&source=gbs_api,http://bks4.books.google.com/books?id=UhExPwAACAAJ&printsec=frontcover&img=1&zoom=2&source=gbs_api,http://bks4.books.google.com/books?id=UhExPwAACAAJ&printsec=frontcover&img=1&zoom=3&source=gbs_api,http://books.google.com/books?id=UhExPwAACAAJ&dq=isbn:9780201427653&hl=&cd=1&source=gbs_api
Software Engineering,"Barry W. Boehm's Lifetime Contributions to Software Development, Management, and Research",Richard W. Selby,9780470148730,QA76.758 S64563 2007,2007-06-04,"This is the most authoritative archive of Barry Boehm's contributions to software engineering. Featuring 42 reprinted articles, along with an introduction and chapter summaries to provide context, it serves as a how-to reference manual for software engineering best practices. It provides convenient access to Boehm's landmark work on product development and management processes. The book concludes with an insightful look to the future by Dr. Boehm.",http://bks9.books.google.com/books?id=ttaMIFv8bv8C&printsec=frontcover&img=1&zoom=5&edge=none&source=gbs_api,http://bks9.books.google.com/books?id=ttaMIFv8bv8C&printsec=frontcover&img=1&zoom=1&edge=none&source=gbs_api,http://bks9.books.google.com/books?id=ttaMIFv8bv8C&printsec=frontcover&img=1&zoom=2&edge=none&source=gbs_api,http://bks9.books.google.com/books?id=ttaMIFv8bv8C&printsec=frontcover&img=1&zoom=3&edge=none&source=gbs_api,http://books.google.com/books?id=ttaMIFv8bv8C&printsec=frontcover&dq=isbn:9780470148730&hl=&cd=1&source=gbs_api
